send_dt,send_time,send_number,campaign,email_name,category,subject,emails_sent,emails_delivered,undeliverable,total_clicks,unique_clicks,unique_opens,unsubscribes,unique_complaints,total_complaints,gifts,revenue,Audience
3/10/2022,8:52:36 PM,1,DAF,2022-03-10-DAF-Postcard,fundraising,[NONPROFIT]'s Ukraine response and how you can make a greater impact,968,966,2,4,4,381,0,0,0,0,0,Other
6/29/2021,2:03:54 PM,1,EOQ,2021-06-EOQ-deadline-E1-Partner-B,fundraising,You make our work possible,6829,6819,10,21,18,1603,3,0,0,7,3850,Partners
6/29/2021,2:03:48 PM,1,EOQ,2021-06-EOQ-deadline-E1-FM-PNB-B,fundraising,You make our work possible,84,84,0,0,0,21,0,0,0,0,0,PNB
6/29/2021,2:03:57 PM,1,EOQ,2021-06-EOQ-deadline-E1-Partner-A,fundraising,DEADLINE: We?re just short of our goal,6882,6874,8,38,27,1494,10,4,4,14,6150,Partners
6/29/2021,2:03:49 PM,1,EOQ,2021-06-EOQ-deadline-E1-FM-PNB-A,fundraising,DEADLINE: We?re just short of our goal,80,80,0,1,1,16,1,1,1,0,0,PNB
6/30/2021,9:02:57 PM,2,EOQ,2021-06-EOQ-deadline-E2-FM-PNB-A,fundraising,FWD: We?re so close to the finish line,158,158,0,0,0,41,0,0,0,0,0,PNB
6/30/2021,9:00:39 PM,2,EOQ,2021-06-EOQ-deadline-E2-Partner-A,fundraising,FWD: We?re so close to the finish line,19,19,0,1,1,16,0,0,0,20,7975,Partners
6/30/2021,9:02:57 PM,2,EOQ,2021-06-EOQ-deadline-E2-Partner-A,fundraising,FWD: We?re so close to the finish line,12851,12830,21,80,52,2977,10,3,3,20,7975,Partners
9/10/2020,1:10:00 AM,1,Moira,2020-09-Moira-Field-Partner,Appeal,Fires leave Moria refugee camp in ashes,58679,58578,101,707,480,9709,17,3,3,280,24998,Field Partners
9/10/2020,1:01:00 AM,1,Moira,2020-09-Moira-AD-0-12-month-donors,Appeal,Fires leave Moria refugee camp in ashes,57593,57458,135,,263,8555,35,10,10,124,8454,First Levels
9/10/2020,1:01:00 AM,1,Moira,2020-09-Moira-AD-13-24-month-donors-B,Appeal,Fires leave Moria refugee camp in ashes,15887,15874,13,29,27,1718,8,2,2,7,605,Lapsed Donors
9/10/2020,1:10:00 AM,1,Moira,2020-09-Moira-Cultivation-Partners,Appeal,Fires leave Moria refugee camp in ashes,14927,14904,23,108,82,2905,15,6,6,29,13950,Partners
9/10/2020,1:01:00 AM,1,Moira,2020-09-Moira-AD-25-36-month-donors-B,Appeal,Fires leave Moria refugee camp in ashes,15167,15147,20,25,22,1469,8,3,3,6,390,Lapsed Donors
9/10/2020,1:01:00 AM,1,Moira,2020-09-Moira-AD-25-36-month-donors,Appeal,Fires leave Moria refugee camp in ashes,15168,15149,19,,16,1442,12,2,2,8,827,Lapsed Donors
9/10/2020,1:01:00 AM,1,Moira,2020-09-Moira-AD-37-month-donors-B,Appeal,Fires leave Moria refugee camp in ashes,24407,24367,40,78,61,6566,19,8,8,7,750,Lapsed Donors
9/10/2020,1:01:00 AM,1,Moira,2020-09-Moira-AD-0-12-month-donors-B,Appeal,Fires leave Moria refugee camp in ashes,57593,57439,154,290,233,8462,35,6,6,89,7378,First Levels
9/10/2020,1:08:00 AM,1,Moira,2020-09-Moira-Non-Donors-B,Appeal,Fires leave Moria refugee camp in ashes,153409,153175,234,221,180,12891,116,22,22,11,395,Non Donors
9/10/2020,1:10:00 AM,1,Moira,2020-09-Moira-Cultivation-PNB,Appeal,Fires leave Moria refugee camp in ashes,175,175,0,2,2,39,0,0,0,1,1000,PNB
9/10/2020,1:01:00 AM,1,Moira,2020-09-Moira-AD-37-month-donors,Appeal,Fires leave Moria refugee camp in ashes,24408,24369,39,,61,6585,20,3,3,16,1865,Lapsed Donors
9/10/2020,1:08:00 AM,1,Moira,2020-09-Moira-Non-Donors,Appeal,Fires leave Moria refugee camp in ashes,153409,153180,229,,181,13056,128,21,21,11,1505,Non Donors
9/10/2020,1:01:00 AM,1,Moira,2020-09-Moira-AD-13-24-month-donors,Appeal,Fires leave Moria refugee camp in ashes,15886,15871,15,,19,1653,9,3,3,6,1400,Lapsed Donors
11/11/2020,7:01:48 PM,1,AI Hol,2020-11-Al-Hol-1-AD-13-24-month-donors-A,Appeal,Worsening conditions in northeast Syria,15070,15053,17,26,21,1618,6,3,3,0,0,Lapsed Donors
11/11/2020,7:01:50 PM,1,AI Hol,2020-11-Al-Hol-1-AD-25-36-month-donors-B,Appeal,Worsening conditions in northeast Syria,14165,14151,14,20,13,1332,8,1,1,0,0,Lapsed Donors
11/11/2020,7:01:47 PM,1,AI Hol,2020-11-Al-Hol-1-AD-13-24-month-donors-B,Appeal,Worsening conditions in northeast Syria,15069,15052,17,35,26,1557,6,4,4,5,245,Lapsed Donors
11/11/2020,7:01:50 PM,1,AI Hol,2020-11-Al-Hol-1-AD-37-month-donors-B,Appeal,Worsening conditions in northeast Syria,24461,24437,24,37,31,6215,19,5,5,2,110,Lapsed Donors
11/11/2020,7:00:50 PM,1,AI Hol,2020-11-Al-Hol-1-Standard-Partner,Appeal,Worsening conditions in northeast Syria,13718,13694,24,57,41,2528,6,2,2,17,8325,Partners
11/11/2020,7:01:50 PM,1,AI Hol,2020-11-Al-Hol-1-AD-0-12-month-donors-A,Appeal,Worsening conditions in northeast Syria,57406,57311,95,192,153,8089,43,25,25,0,0,First Levels
11/11/2020,7:01:42 PM,1,AI Hol,2020-11-Al-Hol-1-AD-25-36-month-donors-A,Appeal,Worsening conditions in northeast Syria,14165,14136,29,25,20,1321,2,0,0,0,0,Lapsed Donors
11/11/2020,7:01:50 PM,1,AI Hol,2020-11-Al-Hol-1-AD-37-month-donors-A,Appeal,Worsening conditions in northeast Syria,24461,24440,21,40,36,6284,16,4,4,0,0,Lapsed Donors
11/11/2020,7:01:50 PM,1,AI Hol,2020-11-Al-Hol-1-AD-0-12-month-donors-B,Appeal,Worsening conditions in northeast Syria,57405,57323,82,162,137,8128,21,11,12,46,2874,First Levels
11/11/2020,7:00:46 PM,1,AI Hol,2020-11-Al-Hol-1-PNB,Appeal,Worsening conditions in northeast Syria,168,168,0,0,0,30,0,0,0,0,0,PNB
11/11/2020,7:01:10 PM,1,AI Hol,2020-11-Al-Hol-1-AD-Non-Donors-A,Appeal,Worsening conditions in northeast Syria,354252,351059,3193,957,812,31600,305,69,76,0,0,Non Donors
11/11/2020,7:00:58 PM,1,AI Hol,2020-11-Al-Hol-1-Field-Partner,Appeal,Worsening conditions in northeast Syria,58668,58612,56,397,296,9591,22,8,8,156,13379,Field Partners
11/12/2020,11:01:51 PM,2,AI Hol,2020-11-Al-Hol-2-AD-0-12-month-donors-A,Appeal,[Help Needed] COVID-19 in northeast Syria,57089,57003,86,157,125,8468,46,19,19,0,0,First Levels
11/12/2020,11:01:51 PM,2,AI Hol,2020-11-Al-Hol-2-AD-13-24-month-donors-A,Appeal,[Help Needed] COVID-19 in northeast Syria,15137,15117,20,17,16,1770,9,5,5,0,0,Lapsed Donors
11/12/2020,11:01:51 PM,2,AI Hol,2020-11-Al-Hol-2-AD-37-month-donors-B,Appeal,[Help Needed] COVID-19 in northeast Syria,24780,24754,26,44,33,6487,16,4,4,2,115,Lapsed Donors
11/12/2020,11:01:43 PM,2,AI Hol,2020-11-Al-Hol-2-AD-25-36-month-donors-A,Appeal,[Help Needed] COVID-19 in northeast Syria,14077,14050,27,15,14,1539,10,1,1,0,0,Lapsed Donors
11/12/2020,11:01:06 PM,2,AI Hol,2020-11-Al-Hol-2-AD-Non-donors,Appeal,[Help Needed] COVID-19 in northeast Syria,353378,350221,3157,744,645,35074,264,60,67,20,1435,Non Donors
11/12/2020,11:01:51 PM,2,AI Hol,2020-11-Al-Hol-2-AD-0-12-month-donors-B,Appeal,[Help Needed] COVID-19 in northeast Syria,57090,56998,92,149,129,8483,41,19,20,39,2632,First Levels
11/12/2020,11:01:51 PM,2,AI Hol,2020-11-Al-Hol-2-AD-25-36-month-donors-B,Appeal,[Help Needed] COVID-19 in northeast Syria,14077,14058,19,14,10,1484,6,2,2,2,303,Lapsed Donors
11/12/2020,11:01:51 PM,2,AI Hol,2020-11-Al-Hol-2-AD-37-month-donors-A,Appeal,[Help Needed] COVID-19 in northeast Syria,24779,24746,33,43,33,6546,16,7,7,0,0,Lapsed Donors
11/12/2020,11:01:50 PM,2,AI Hol,2020-11-Al-Hol-2-AD-13-24-month-donors-B,Appeal,[Help Needed] COVID-19 in northeast Syria,15138,15111,27,32,20,1780,11,4,4,5,245,Lapsed Donors
11/13/2020,9:00:48 PM,3,AI Hol,2020-11-Al-Hol-3-PNB,Appeal,"We?re doing what we can, %%[ VAR @DefaultName, @Salutation Set @DefaultName = 'Friend' IF LENGTH([FirstName]) > 1 THEN Set @Salutation = Concat(ProperCase([FirstName])) ELSE set @Salutation = @Default",168,168,0,0,0,37,0,0,0,0,0,PNB
11/13/2020,9:00:57 PM,3,AI Hol,2020-11-Al-Hol-3-AD-0-12-month-donors,Appeal,"We?re doing what we can, %%[ VAR @DefaultName, @Salutation Set @DefaultName = 'Friend' IF LENGTH([FirstName]) > 1 THEN Set @Salutation = Concat(ProperCase([FirstName])) ELSE set @Salutation = @Default",113777,112058,1719,441,357,19417,134,33,33,120,9696.11,First Levels
11/13/2020,9:00:53 PM,3,AI Hol,2020-11-Al-Hol-3-AD-13-24-month-donors,Appeal,"We?re doing what we can, %%[ VAR @DefaultName, @Salutation Set @DefaultName = 'Friend' IF LENGTH([FirstName]) > 1 THEN Set @Salutation = Concat(ProperCase([FirstName])) ELSE set @Salutation = @Default",30235,30070,165,42,36,4094,23,5,5,8,605,Lapsed Donors
11/13/2020,9:00:53 PM,3,AI Hol,2020-11-Al-Hol-3-AD-25-36-month-donors,Appeal,"We?re doing what we can, %%[ VAR @DefaultName, @Salutation Set @DefaultName = 'Friend' IF LENGTH([FirstName]) > 1 THEN Set @Salutation = Concat(ProperCase([FirstName])) ELSE set @Salutation = @Default",28124,27964,160,31,26,3504,26,3,3,3,175,Lapsed Donors
11/13/2020,9:00:53 PM,3,AI Hol,2020-11-Al-Hol-3-AD-37-month-donors,Appeal,"We?re doing what we can, %%[ VAR @DefaultName, @Salutation Set @DefaultName = 'Friend' IF LENGTH([FirstName]) > 1 THEN Set @Salutation = Concat(ProperCase([FirstName])) ELSE set @Salutation = @Default",49490,48618,872,137,119,14490,59,12,12,15,1925,Lapsed Donors
11/13/2020,9:01:10 PM,3,AI Hol,2020-11-Al-Hol-3-AD-Non-Donors,Appeal,"We?re doing what we can, %%[ VAR @DefaultName, @Salutation Set @DefaultName = 'Friend' IF LENGTH([FirstName]) > 1 THEN Set @Salutation = Concat(ProperCase([FirstName])) ELSE set @Salutation = @Default",350440,347580,2860,1115,971,40013,525,71,78,0,0,Non Donors
11/13/2020,9:00:54 PM,3,AI Hol,2020-11-Al-Hol-3-Standard-Partner,Appeal,"We?re doing what we can, %%[ VAR @DefaultName, @Salutation Set @DefaultName = 'Friend' IF LENGTH([FirstName]) > 1 THEN Set @Salutation = Concat(ProperCase([FirstName])) ELSE set @Salutation = @Default",13671,13441,230,91,65,3068,22,6,6,41,36225,Partners
7/19/2022,1:00:41 PM,1,Append,2022-07-15-Append-0-12-Month-Donors,cultivation,"%%[ VAR @DefaultName, @Salutation Set @DefaultName = 'Friend' IF LENGTH([FirstName]) > 1 THEN Set @Salutation = Concat(ProperCase([FirstName])) ELSE set @Salutation = @DefaultName ENDIF)]%%We want to",19787,18645,1142,217,166,3225,132,46,46,0,0,First Levels
3/30/2020,12:15:41 AM,1,EOQ #1,2020-03-EOQ-Kickoff-1-AD-37-month-donors,Appeal,We're suspending our face-to-face fundraising,50933,50881,52,238,205,21642,52,11,11,35,2080,Lapsed Donors
3/30/2020,12:00:59 AM,1,EOQ #1,2020-03-EOQ-Kickoff-1-AD-0-12-month-donors,Appeal,We're suspending our face-to-face fundraising,87051,86923,128,424,331,18290,42,17,17,103,6386,First Levels
3/30/2020,12:05:42 AM,1,EOQ #1,2020-03-EOQ-Kickoff-1-AD-13-24-month-donors,Appeal,We're suspending our face-to-face fundraising,39150,39093,57,98,89,6565,15,4,4,24,1650,Lapsed Donors
3/30/2020,12:10:52 AM,1,EOQ #1,2020-03-EOQ-Kickoff-1-AD-25-36-month-donors,Appeal,We're suspending our face-to-face fundraising,34310,34253,57,158,48,5425,7,0,0,16,2080,Lapsed Donors
3/30/2020,12:20:52 AM,1,EOQ #1,2020-03-EOQ-Kickoff-1-Non-Donors,Appeal,We're suspending our face-to-face fundraising,192415,192030,385,478,366,32420,171,48,48,9,390,Non Donors
3/31/2020,,2,EOQ #2,2020-03-EOQ-2-Appeal-AD-25-36-month-donors,Appeal,Help us close the gap,17128,17101,27,31,26,1639,8,2,2,17,890,Lapsed Donors
3/31/2020,,2,EOQ #2,jtk477 - EOQ Sustainer 2 - First Levels 25-36 - v1,Appeal,Help us close the gap,17129,17116,13,27,23,1662,3,1,1,,,Lapsed Donors
3/31/2020,,2,EOQ #2,2020-03-EOQ-2-Appeal-AD-37-month-donors,Appeal,Help us close the gap,25382,25352,30,96,89,8002,19,6,6,43,3910,Lapsed Donors
3/31/2020,,2,EOQ #2,2020-03-EOQ-2-Appeal-AD-0-12-month-donors,Appeal,Help us close the gap,43375,43336,39,150,129,6009,14,6,6,129,10666,First Levels
3/31/2020,,2,EOQ #2,2020-03-EOQ-2-Appeal-AD-13-24-month-donors,Appeal,Help us close the gap,19523,19511,12,40,32,2116,10,7,7,27,1660,Lapsed Donors
3/31/2020,,2,EOQ #2,jtk477 - EOQ Sustainer 2 - First Levels 13-24 - v1,Appeal,Help us close the gap,19523,19503,20,80,31,2136,7,3,3,,,Lapsed Donors
3/31/2020,,2,EOQ #2,jtk477 - EOQ Sustainer 2 - First Levels 0-12 - v1,Appeal,Help us close the gap,43374,43314,60,149,124,6190,8,4,4,,,First Levels
3/31/2020,,2,EOQ #2,jtk477 - EOQ Sustainer 2 - First Levels 37+ - v1,Appeal,Help us close the gap,25382,25371,11,130,68,8033,14,5,5,,,Lapsed Donors
3/31/2020,,2,EOQ #2,jtk477 - EOQ Sustainer 2 - Non-Donors - v1,Appeal,Help us close the gap,96002,95828,174,150,123,11780,43,10,10,,,Non Donors
3/31/2020,,2,EOQ #2,2020-03-EOQ-2-Appeal-Non-Donors,Appeal,Help us close the gap,96002,95834,168,179,137,11609,58,13,13,15,2025,Non Donors
3/31/2020,11:30:57 PM,3,EOQ #3,2020-03-EOQ-3-Appeal-Non-Donors,Appeal,Our medical teams need your help by midnight,191505,191158,347,483,418,26854,109,24,24,39,2138,Non Donors
3/31/2020,11:30:43 PM,3,EOQ #3,2020-03-EOQ-3-Appeal-AD-13-24-month-donors,Appeal,Our medical teams need your help by midnight,38790,38755,35,143,119,4834,7,3,3,61,4806,Lapsed Donors
3/31/2020,11:30:43 PM,3,EOQ #3,2020-03-EOQ-3-Appeal-AD-25-36-month-donors,Appeal,Our medical teams need your help by midnight,34160,34122,38,91,72,3993,10,2,2,29,1950,Lapsed Donors
3/31/2020,11:30:43 PM,3,EOQ #3,2020-03-EOQ-3-Appeal-AD-37-month-donors,Appeal,Our medical teams need your help by midnight,50529,50483,46,304,231,17101,39,12,12,67,9435,Lapsed Donors
3/31/2020,11:30:57 PM,3,EOQ #3,2020-03-EOQ-3-Appeal-AD-0-12-month-donors,Appeal,Our medical teams need your help by midnight,82150,82065,85,470,428,13111,28,9,9,245,17114,First Levels
12/26/2019,1:05:59 PM,1,EOY #1,jtk270 2019-12 December End of Year 1 Appeal Field Partners,Appeal,Our most important goal yet (you can help save lives),61299,61084,215,297,206,9738,111,13,13,50,4675,Partners
12/26/2019,1:05:58 PM,1,EOY #1,jtk270 2019-12 December End of Year 1 Appeal AD 0-12 month donors,Appeal,Our most important goal yet (you can help save lives),91804,91257,547,523,433,13292,283,41,41,130,13415,First Levels
12/26/2019,1:05:50 PM,1,EOY #1,jtk270 2019-12 December End of Year 1 Appeal AD 25-36 month donors,Appeal,Our most important goal yet (you can help save lives),37561,37444,117,169,119,3474,128,13,13,15,3830,Lapsed Donors
12/26/2019,1:05:58 PM,1,EOY #1,jtk270 2019-12 December End of Year 1 Appeal Non-Donors,Appeal,Our most important goal yet (you can help save lives),86970,86760,210,473,328,23845,369,36,36,6,440,Non Donors
12/26/2019,1:05:50 PM,1,EOY #1,jtk270 2019-12 December End of Year 1 Appeal AD 13-24 month donors,Appeal,Our most important goal yet (you can help save lives),40609,40474,135,173,147,4094,103,15,15,43,6840,Lapsed Donors
12/26/2019,1:05:49 PM,1,EOY #1,jtk270 2019-12 December End of Year 1 Appeal AD 37+ month donors,Appeal,Our most important goal yet (you can help save lives),33750,33582,168,208,173,12169,162,17,17,23,4653,Lapsed Donors
12/26/2019,1:05:46 PM,1,EOY #1,jtk270 2019-12 December End of Year 1 Appeal PNB,Appeal,Our most important goal yet (you can help save lives),126,126,0,2,2,25,2,0,0,1,40,PNB
12/26/2019,1:05:53 PM,1,EOY #1,jtk270 2019-12 December End of Year 1 Appeal Partners,Appeal,Our most important goal yet (you can help save lives),14165,14094,71,126,94,2688,35,7,7,37,39525,Partners
12/27/2019,2:15:48 PM,2,EOY #2,jtk271 2019-12 December End of Year 2 Appeal Field Partner,Appeal,We need to talk about Yemen,61077,60715,362,345,270,10009,117,11,11,83,10835,Partners
12/27/2019,2:15:47 PM,2,EOY #2,jtk271 2019-12 December End of Year 2 Appeal AD 37+ month donors,Appeal,We need to talk about Yemen,33465,32968,497,219,177,12122,164,16,16,25,2763,Lapsed Donors
12/27/2019,2:15:48 PM,2,EOY #2,jtk271 2019-12 December End of Year 2 Appeal Partners,Appeal,We need to talk about Yemen,14024,13846,178,115,87,2668,31,8,8,40,39050,Partners
12/27/2019,2:16:00 PM,2,EOY #2,jtk271 2019-12 December End of Year 2 Appeal AD 0-12 month donors,Appeal,We need to talk about Yemen,90602,89686,916,593,497,13001,311,43,43,160,23871,First Levels
12/27/2019,2:15:48 PM,2,EOY #2,jtk271 2019-12 December End of Year 2 Appeal AD 25-36 month donors,Appeal,We need to talk about Yemen,36959,36772,187,201,146,3526,133,11,11,25,8943,Lapsed Donors
12/27/2019,2:15:48 PM,2,EOY #2,jtk271 2019-12 December End of Year 2 Appeal AD 13-24 month donors,Appeal,We need to talk about Yemen,39918,39712,206,185,158,4260,117,10,11,42,6752,Lapsed Donors
12/27/2019,2:15:40 PM,2,EOY #2,jtk271 2019-12 December End of Year 2 Appeal PNB,Appeal,We need to talk about Yemen,123,121,2,2,2,31,2,0,0,0,0,PNB
12/27/2019,2:15:48 PM,2,EOY #2,jtk271 2019-12 December End of Year 2 Appeal Non-Donors,Appeal,We need to talk about Yemen,86460,86029,431,527,398,24478,395,43,43,7,970,Non Donors
12/28/2019,2:05:59 PM,3,EOY #3,jtk272 - 2019-12 December End of Year 3 Appeal AD 13-24 month donors,Appeal,How we help mothers and babies (counting on you),40398,40289,109,254,163,5129,197,62,62,26,3310,Lapsed Donors
12/28/2019,2:06:11 PM,3,EOY #3,jtk272 - 2019-12 December End of Year 3 Appeal Field Partner,Appeal,How we help mothers and babies (counting on you),60818,60693,125,349,252,11294,311,85,86,43,7775,Partners
12/28/2019,2:06:00 PM,3,EOY #3,jtk272 - 2019-12 December End of Year 3 Appeal AD 25-36 month donors,Appeal,How we help mothers and babies (counting on you),36439,36356,83,156,118,4186,170,42,42,8,755,Lapsed Donors
12/28/2019,2:06:09 PM,3,EOY #3,jtk272 - 2019-12 December End of Year 3 Appeal Non-Donors,Appeal,How we help mothers and babies (counting on you),86090,85907,183,561,434,26748,513,79,79,8,580,Non Donors
12/28/2019,2:06:01 PM,3,EOY #3,jtk272 - 2019-12 December End of Year 3 Appeal AD 37+ month donors,Appeal,How we help mothers and babies (counting on you),33288,33195,93,267,214,13466,289,58,58,13,3255,Lapsed Donors
12/28/2019,2:05:59 PM,3,EOY #3,jtk272 - 2019-12 December End of Year 3 Appeal PNB,Appeal,How we help mothers and babies (counting on you),123,123,0,0,0,31,1,1,1,0,0,PNB
12/28/2019,2:06:09 PM,3,EOY #3,jtk272 - 2019-12 December End of Year 3 Appeal AD 0-12 month donors,Appeal,How we help mothers and babies (counting on you),89195,88803,392,654,429,14672,540,196,196,61,8113,First Levels
12/28/2019,2:05:58 PM,3,EOY #3,jtk272 - 2019-12 December End of Year 3 Appeal Partners,Appeal,How we help mothers and babies (counting on you),13823,13769,54,98,74,2919,65,15,15,21,13710,Partners
12/29/2019,2:35:50 PM,4,EOY #4,jtk273 2019-12 December End of Year 4 Appeal AD 25-36 month donors,Appeal,We refuse to stand by as people drown,35977,35870,107,147,130,3541,104,9,9,26,4925,Lapsed Donors
12/29/2019,2:35:50 PM,4,EOY #4,jtk273 2019-12 December End of Year 4 Appeal AD 13-24 month donors,Appeal,We refuse to stand by as people drown,39717,39576,141,222,194,4362,130,10,10,63,7245,Lapsed Donors
12/29/2019,2:35:49 PM,4,EOY #4,jtk273 2019-12 December End of Year 4 Appeal AD 0-12 month donors,Appeal,We refuse to stand by as people drown,87848,87375,473,626,504,12817,326,41,41,161,18740,First Levels
12/29/2019,2:35:49 PM,4,EOY #4,jtk273 2019-12 December End of Year 4 Appeal AD 37+ month donors,Appeal,We refuse to stand by as people drown,32950,32728,222,234,197,12183,190,17,17,25,2580,Lapsed Donors
12/29/2019,2:35:49 PM,4,EOY #4,jtk273 2019-12 December End of Year 4 Appeal Non-Donors,Appeal,We refuse to stand by as people drown,85511,85309,202,465,375,23962,366,21,21,12,1735,Non Donors
12/30/2019,10:15:46 AM,5,EOY #5,jtk274 2019-12 December End of Year 5 Appeal AD 13-24 month donors,Appeal,Re: the next emergency,38924,38816,108,296,242,4412,164,16,16,86,9347,Lapsed Donors
12/30/2019,10:15:56 AM,5,EOY #5,jtk274 2019-12 December End of Year 5 Appeal Field Partners,Appeal,Re: the next emergency,60424,60277,147,312,259,10264,143,13,13,57,9090,Partners
12/30/2019,10:15:57 AM,5,EOY #5,jtk274 2019-12 December End of Year 5 Appeal AD 0-12 month donors,Appeal,Re: the next emergency,86203,85804,399,709,590,12649,336,35,35,236,31028,First Levels
12/30/2019,10:15:46 AM,5,EOY #5,jtk274 2019-12 December End of Year 5 Appeal AD 37+ month donors,Appeal,Re: the next emergency,32863,32748,115,265,224,12477,206,10,10,29,4618,Lapsed Donors
12/30/2019,10:15:47 AM,5,EOY #5,jtk274 2019-12 December End of Year 5 Appeal Partners,Appeal,Re: the next emergency,13365,13306,59,163,129,2641,36,3,3,67,48750,Partners
12/30/2019,10:15:46 AM,5,EOY #5,jtk274 2019-12 December End of Year 5 Appeal AD 25-36 month donors,Appeal,Re: the next emergency,35152,35062,90,221,160,3561,127,12,12,41,8490,Lapsed Donors
12/30/2019,10:15:57 AM,5,EOY #5,jtk274 2019-12 December End of Year 5 Appeal Non-Donors,Appeal,Re: the next emergency,84894,84735,159,508,416,24680,417,30,30,14,12080,Non Donors
12/30/2019,10:15:40 AM,5,EOY #5,jtk274 2019-12 December End of Year 5 Appeal PNB,Appeal,Re: the next emergency,119,119,0,2,2,33,0,0,0,0,0,PNB
12/30/2019,10:15:57 PM,6,EOY #6,jtk275 2019-12 December End of Year 6 Appeal AD 13-24 month donors,Appeal,Did you see this?,38689,38562,127,380,250,4577,168,17,17,81,14599,Lapsed Donors
12/30/2019,10:15:57 PM,6,EOY #6,jtk275 2019-12 December End of Year 6 Appeal AD 0-12 month donors,Appeal,Did you see this?,85662,85198,464,1010,645,13220,329,54,56,305,36917,First Levels
12/30/2019,10:15:57 PM,6,EOY #6,jtk275 2019-12 December End of Year 6 Appeal Non-Donors,Appeal,Did you see this?,84448,84264,184,644,421,25618,484,38,38,16,5600,Non Donors
12/30/2019,10:15:57 PM,6,EOY #6,jtk275 2019-12 December End of Year 6 Appeal PNB,Appeal,Did you see this?,119,118,1,2,2,34,1,0,0,1,100,PNB
12/30/2019,10:15:57 PM,6,EOY #6,jtk275 2019-12 December End of Year 6 Appeal AD 37+ month donors,Appeal,Did you see this?,32613,32495,118,393,228,12580,231,19,19,27,4205,Lapsed Donors
12/30/2019,10:15:57 PM,6,EOY #6,jtk275 2019-12 December End of Year 6 Appeal AD 25-36 month donors,Appeal,Did you see this?,34995,34891,104,229,159,3852,150,14,14,34,18770,Lapsed Donors
12/30/2019,10:15:57 PM,6,EOY #6,jtk275 2019-12 December End of Year 6 Appeal Partners,Appeal,Did you see this?,13214,13149,65,185,102,2846,50,6,6,40,32325,Partners
12/30/2019,10:15:57 PM,6,EOY #6,jtk275 2019-12 December End of Year 6 Appeal Field Partners,Appeal,Did you see this?,60216,60034,182,465,268,10231,162,20,20,73,8895,Partners
12/31/2019,9:35:39 AM,7,EOY #7,jtk276 - 2019-12 December End of Year 7 Appeal PNB,Appeal,You can help us save lives in 2020 (running out of time),118,118,0,0,0,30,0,0,0,0,0,PNB
12/31/2019,9:35:50 AM,7,EOY #7,jtk276 - 2019-12 December End of Year 7 Appeal Field Partner,Appeal,You can help us save lives in 2020 (running out of time),59979,59857,122,319,275,9013,141,13,13,100,18570,Partners
12/31/2019,9:35:50 AM,7,EOY #7,jtk276 - 2019-12 December End of Year 7 Appeal Non-Donors,Appeal,You can help us save lives in 2020 (running out of time),84090,83925,165,409,323,21765,338,33,33,19,8630,Non Donors
12/31/2019,9:35:51 AM,7,EOY #7,jtk276 - 2019-12 December End of Year 7 Appeal 25-36 Month Donors,Appeal,You can help us save lives in 2020 (running out of time),31652,31558,94,148,91,2712,83,7,7,22,3763,Lapsed Donors
12/31/2019,9:35:50 AM,7,EOY #7,jtk276 - 2019-12 December End of Year 7 Appeal 37+ Month Donors,Appeal,You can help us save lives in 2020 (running out of time),32374,32282,92,228,180,12008,147,20,20,43,4555,Lapsed Donors
12/31/2019,9:35:51 AM,7,EOY #7,jtk276 - 2019-12 December End of Year 7 Appeal 0-12 Month Donors,Appeal,You can help us save lives in 2020 (running out of time),75872,75483,389,408,355,10278,262,38,38,115,12043,First Levels
12/31/2019,9:35:49 AM,7,EOY #7,jtk276 - 2019-12 December End of Year 7 Appeal Partners,Appeal,You can help us save lives in 2020 (running out of time),12864,12799,65,199,150,2418,36,4,7,83,81400,Partners
12/31/2019,9:35:51 AM,7,EOY #7,jtk276 - 2019-12 December End of Year 7 Appeal 13-24 Month Donors,Appeal,You can help us save lives in 2020 (running out of time),35196,35071,125,184,151,3355,99,10,10,57,6814,Lapsed Donors
12/31/2019,7:15:36 PM,8,EOY #8,jtk277 2019-12 December End of Year 8 Appeal PNB,Appeal,Last call: Give to save lives in 2020,118,118,0,3,3,22,1,0,0,2,750,PNB
12/31/2019,7:15:56 PM,8,EOY #8,jtk277 2019-12 December End of Year 8 Appeal AD 0-12 month donors,Appeal,Last call: Give to save lives in 2020,75521,75178,343,431,375,10112,205,34,35,161,18125,First Levels
12/31/2019,7:15:42 PM,8,EOY #8,jtk277 2019-12 December End of Year 8 Appeal Non-Donors,Appeal,Last call: Give to save lives in 2020,83760,83597,163,340,298,21827,296,29,29,23,3585,Non Donors
12/31/2019,7:15:42 PM,8,EOY #8,jtk277 2019-12 December End of Year 8 Appeal AD 13-24 month donors,Appeal,Last call: Give to save lives in 2020,35019,34924,95,199,171,3335,78,10,10,79,10487,Lapsed Donors
12/31/2019,7:15:42 PM,8,EOY #8,jtk277 2019-12 December End of Year 8 Appeal Partners,Appeal,Last call: Give to save lives in 2020,12681,12622,59,191,171,2464,39,7,7,119,104899,Partners
12/31/2019,7:15:45 PM,8,EOY #8,jtk277 2019-12 December End of Year 8 Appeal AD 37+ month donors,Appeal,Last call: Give to save lives in 2020,32181,32079,102,283,223,11708,161,6,6,61,10100,Lapsed Donors
12/31/2019,7:15:43 PM,8,EOY #8,jtk277 2019-12 December End of Year 8 Appeal AD 25-36 month donors,Appeal,Last call: Give to save lives in 2020,31532,31456,76,119,110,2736,88,10,10,28,3685,Lapsed Donors
12/31/2019,7:15:56 PM,8,EOY #8,jtk277 2019-12 December End of Year 8 Appeal Field Partners,Appeal,Last call: Give to save lives in 2020,59778,59652,126,345,295,8892,176,13,13,94,13367,Partners
12/31/2019,1:25:45 AM,9,EOY #9,jtk278 2019-12 December End of Year 9 Appeal AD 0-12 month donors,Appeal,No better time,75142,74767,375,563,313,10266,231,38,38,87,7219,First Levels
12/31/2019,1:25:44 AM,9,EOY #9,jtk278 2019-12 December End of Year 9 Appeal AD 13-24 month donors,Appeal,No better time,34846,34748,98,276,158,3439,96,12,12,62,6562,Lapsed Donors
12/31/2019,1:25:44 AM,9,EOY #9,jtk278 2019-12 December End of Year 9 Appeal AD 25-36 month donors,Appeal,No better time,31424,31348,76,151,102,2684,96,14,14,18,4365,Lapsed Donors
12/31/2019,1:25:44 AM,9,EOY #9,jtk278 2019-12 December End of Year 9 Appeal AD 37+ month donors,Appeal,No better time,31974,31862,112,326,181,11812,150,15,15,30,4945,Lapsed Donors
12/31/2019,1:25:44 AM,9,EOY #9,jtk278 2019-12 December End of Year 9 Appeal Non-Donors,Appeal,No better time,83514,83345,169,450,269,21936,295,33,33,11,2810,Non Donors
2/17/2022,12:00:41 PM,1,Hayden,2022-02-17-Hayden-Intro-NoMask-Field-Partner,engagement,A quick hello,1525,1521,4,10,7,735,3,3,3,1,30,Field Partners
2/17/2022,12:00:45 PM,1,Hayden,2022-02-17-Hayden-Intro-Mask-Field-Partner,engagement,A quick hello,1506,1503,3,10,7,741,4,2,2,0,0,Field Partners
1/6/2022,7:00:54 PM,1,Hayden,2022-01-sustainer-hayden-Field-Partner,engagement,A quick hello,59016,58944,72,214,177,21611,39,8,8,14,930,Field Partners
8/16/2021,2:03:49 PM,3,[NONPROFIT] way,2021-08-[NONPROFIT]-way-E3-13-37-month-donors,cultivation,How we bear witness,124089,123946,143,581,490,25645,160,34,34,15,910,Lapsed Donors
8/16/2021,2:00:45 PM,3,[NONPROFIT] way,2021-08-[NONPROFIT]-way-E3-Partner,cultivation,How we bear witness,13784,13766,18,118,101,3026,9,1,1,14,5475,Partners
8/16/2021,2:03:52 PM,3,[NONPROFIT] way,2021-08-[NONPROFIT]-way-E3-Non-Donors,cultivation,How we bear witness,219309,218814,495,1200,997,35275,327,71,71,10,660,Non Donors
8/16/2021,2:03:35 PM,3,[NONPROFIT] way,2021-08-[NONPROFIT]-way-E3-0-12-month-donors,cultivation,How we bear witness,116574,116333,241,688,518,19074,114,40,42,61,5426,First Levels
8/16/2021,2:00:44 PM,3,[NONPROFIT] way,2021-08-[NONPROFIT]-way-E3-PNB,cultivation,How we bear witness,217,217,0,3,3,62,0,0,0,0,0,PNB
8/16/2021,2:03:34 PM,3,[NONPROFIT] way,2021-08-[NONPROFIT]-way-E3-Field-Partner,cultivation,How we bear witness,59817,59730,87,597,495,12269,35,10,10,44,5993,Field Partners
8/9/2021,3:03:05 PM,1,[NONPROFIT] way,2021-08-[NONPROFIT]-way-E1-13-37-month-donors,cultivation,All [NONPROFIT] members agree to honor these principles:,124943,124769,174,623,404,22836,175,32,32,17,1340,Lapsed Donors
8/9/2021,3:00:38 PM,1,[NONPROFIT] way,2021-08-[NONPROFIT]-way-E1-PNB,cultivation,All [NONPROFIT] members agree to honor these principles:,221,219,2,0,0,44,0,0,0,0,0,PNB
8/9/2021,3:00:45 PM,1,[NONPROFIT] way,2021-08-[NONPROFIT]-way-E1-Partner,cultivation,All [NONPROFIT] members agree to honor these principles:,13961,13928,33,49,34,2390,7,0,0,14,6650,Partners
8/9/2021,3:02:50 PM,2,[NONPROFIT] way,2021-08-[NONPROFIT]-way-E2-0-12-month-donors-B,cultivation,All [NONPROFIT] members agree to honor these principles:,59635,59470,165,225,146,10077,73,17,17,28,1875.2,First Levels
8/9/2021,3:02:48 PM,1,[NONPROFIT] way,2021-08-[NONPROFIT]-way-E1-Field-Partner,cultivation,All [NONPROFIT] members agree to honor these principles:,60517,60435,82,307,227,11756,24,9,9,27,5175,Field Partners
8/9/2021,3:03:45 PM,1,[NONPROFIT] way,2021-08-[NONPROFIT]-way-E1-Non-Donors,cultivation,All [NONPROFIT] members agree to honor these principles:,220360,219790,570,875,566,30598,288,48,48,6,220,Non Donors
8/9/2021,3:02:50 PM,1,[NONPROFIT] way,2021-08-[NONPROFIT]-way-E1-0-12-month-donors,cultivation,All [NONPROFIT] members agree to honor these principles:,59074,58911,163,211,139,8469,53,19,19,19,1370,First Levels
8/12/2021,10:05:43 PM,2,[NONPROFIT] way,2021-08-[NONPROFIT]-way-E2-0-12-month-donors,cultivation,"This is the [NONPROFIT] Way: Impartiality, Independence, Neutrality",59051,58804,247,183,153,8779,56,32,32,27,2538,First Levels
8/12/2021,10:07:32 PM,2,[NONPROFIT] way,2021-08-[NONPROFIT]-way-E2-Non-Donors,cultivation,"This is the [NONPROFIT] Way: Impartiality, Independence, Neutrality",219704,219206,498,628,511,32097,249,88,88,9,513,Non Donors
8/12/2021,10:06:36 PM,2,[NONPROFIT] way,2021-08-[NONPROFIT]-way-E2-13-37-month-donors,cultivation,"This is the [NONPROFIT] Way: Impartiality, Independence, Neutrality",124614,124333,281,407,347,23767,142,63,63,14,1662.5,Lapsed Donors
8/12/2021,10:05:43 PM,2,[NONPROFIT] way,2021-08-[NONPROFIT]-way-E2-0-12-month-donors-B,cultivation,"This is the [NONPROFIT] Way: Impartiality, Independence, Neutrality",58779,58458,321,187,147,9900,73,33,35,28,1875.2,First Levels
8/12/2021,10:05:35 PM,2,[NONPROFIT] way,2021-08-[NONPROFIT]-way-E2-Field-Partner,cultivation,"This is the [NONPROFIT] Way: Impartiality, Independence, Neutrality",60319,60179,140,248,207,11274,27,16,16,41,18125,Field Partners
7/29/2022,4:05:46 PM,2,Measles,2022-07-29-Measles-Fundraising-E2-13-37-Month-Donors-A,fundraising,Millions of children at risk of measles,62893,62825,68,54,48,20790,15,3,3,4,140,Lapsed Donors
7/29/2022,4:05:52 PM,2,Measles,2022-07-29-Measles-Fundraising-E2-0-12-Month-Donors-B,fundraising,Millions of children at risk of measles,61759,61641,118,109,85,18130,27,9,9,13,1003,First Levels
7/29/2022,4:07:50 PM,2,Measles,2022-07-29-Measles-Fundraising-E2-0-12-Month-Donors-A,fundraising,Millions of children at risk of measles,61701,61593,108,132,107,18244,19,2,2,25,1253,First Levels
7/29/2022,4:05:48 PM,2,Measles,2022-07-29-Measles-Fundraising-E2-Ukraine-Partner,fundraising,Millions of children at risk of measles,788,784,4,8,4,293,1,1,1,1,500,Partners
7/29/2022,4:05:55 PM,2,Measles,2022-07-29-Measles-Fundraising-E2-Non-Donors,fundraising,Millions of children at risk of measles,220850,220428,422,269,175,57410,108,29,30,0,0,Non Donors
7/29/2022,4:05:54 PM,2,Measles,2022-07-29-Measles-Fundraising-E2-13-37-Month-Donors-B,fundraising,Millions of children at risk of measles,62873,62801,72,58,45,20820,15,2,2,2,210,Lapsed Donors
7/29/2022,4:05:44 PM,2,Measles,2022-07-29-Measles-Fundraising-E2-Partner,fundraising,Millions of children at risk of measles,16552,16519,33,58,41,5974,3,3,3,10,3380,Partners
7/27/2022,9:45:55 PM,1,Measles,2022-07-27-Measles-Fundraising-E1-Non-Donors-A,fundraising,"Measles is on the rise worldwide, %%=v(@Salutation)=%%",110774,110554,220,200,119,31952,51,14,14,0,0,Non Donors
7/27/2022,9:45:45 PM,1,Measles,2022-07-27-Measles-Fundraising-E1-Field-Partner-B,fundraising,"Measles is on the rise worldwide, %%=v(@Salutation)=%%",32956,32910,46,78,60,12635,19,9,9,13,11545,Field Partners
7/27/2022,9:46:07 PM,1,Measles,2022-07-27-Measles-Fundraising-E1-Non-Donors-B,fundraising,"Measles is on the rise worldwide, %%=v(@Salutation)=%%",110854,110624,230,154,122,31775,59,17,18,3,165,Non Donors
7/27/2022,9:45:54 PM,1,Measles,2022-07-27-Measles-Fundraising-E1-13-37-Month-Donors-A,fundraising,"Measles is on the rise worldwide, %%=v(@Salutation)=%%",62998,62924,74,62,49,23073,29,10,10,2,260,Lapsed Donors
7/27/2022,9:45:50 PM,1,Measles,2022-07-27-Measles-Fundraising-E1-0-12-Month-Donors-A,fundraising,"Measles is on the rise worldwide, %%=v(@Salutation)=%%",52149,52047,102,160,90,16174,20,8,8,16,1160,First Levels
7/27/2022,9:45:54 PM,1,Measles,2022-07-27-Measles-Fundraising-E1-0-12-Month-Donors-B,fundraising,"Measles is on the rise worldwide, %%=v(@Salutation)=%%",52275,52154,121,135,98,16318,25,17,19,10,851,First Levels
7/27/2022,9:45:45 PM,1,Measles,2022-07-27-Measles-Fundraising-E1-Field-Partner-A,fundraising,"Measles is on the rise worldwide, %%=v(@Salutation)=%%",32890,32859,31,117,72,12596,26,8,10,7,480,Field Partners
7/27/2022,9:45:55 PM,1,Measles,2022-07-27-Measles-Fundraising-E1-13-37-Month-Donors-B,fundraising,"Measles is on the rise worldwide, %%=v(@Salutation)=%%",62975,62901,74,105,69,22978,23,10,10,1,50,Lapsed Donors
7/27/2022,9:47:46 PM,1,Measles,2022-07-27-Measles-Fundraising-E1-Ukraine-FL,fundraising,"Measles is on the rise worldwide, %%=v(@Salutation)=%%",19596,19574,22,45,41,7310,17,5,5,4,175,Other
4/7/2022,3:00:46 PM,2,Tax Day,2022-04-07-Tax-Day-E2-PNB,cultivation,Following up on Corrine?s message,340,339,1,5,5,159,0,0,0,0,0,PNB
4/7/2022,3:00:44 PM,2,Tax Day,2022-04-07-Tax-Day-E2-Partner,cultivation,Following up on Corrine?s message,15868,15835,33,80,63,6385,10,2,2,5,2000,Partners
4/18/2022,2:05:11 PM,1,Tax Day,2022-04-18-Tax-Day-Field-Partner,cultivation,[Tax Day] The impact of your tax-deductible gifts,56664,56563,101,264,162,22670,31,9,9,0,0,Field Partners
4/18/2022,2:00:55 PM,1,Tax Day,2022-04-18-Tax-Day-0-12-Month-Donors,cultivation,"%%[ VAR @DefaultName, @Salutation Set @DefaultName = 'Friend' IF LENGTH([FirstName]) > 1 THEN Set @Salutation = Concat(ProperCase([FirstName])) ELSE set @Salutation = @DefaultName ENDIF)]%%%%=v(@Salut",135365,134701,664,596,377,45191,192,83,85,26,1322,First Levels
4/5/2022,3:00:49 PM,1,Tax Day,2022-04-05-Tax-Day-E1-Moved-Majors,cultivation,"%%[ VAR @DefaultName, @Salutation Set @DefaultName = 'Friend' IF LENGTH([FirstName]) > 1 THEN Set @Salutation = Concat(ProperCase([FirstName])) ELSE set @Salutation = @DefaultName ENDIF)]%%%%=v(@Salut",2108,2103,5,18,10,898,1,0,0,0,0,Other
4/5/2022,3:00:44 PM,1,Tax Day,2022-04-05-Tax-Day-E1-Partner,cultivation,"%%[ VAR @DefaultName, @Salutation Set @DefaultName = 'Friend' IF LENGTH([FirstName]) > 1 THEN Set @Salutation = Concat(ProperCase([FirstName])) ELSE set @Salutation = @DefaultName ENDIF)]%%%%=v(@Salut",15907,15873,34,75,60,6118,4,3,3,1,500,Partners
4/18/2022,2:01:00 PM,1,Tax Day,2022-04-18-Tax-Day-Non-Donors,cultivation,"%%[ VAR @DefaultName, @Salutation Set @DefaultName = 'Friend' IF LENGTH([FirstName]) > 1 THEN Set @Salutation = Concat(ProperCase([FirstName])) ELSE set @Salutation = @DefaultName ENDIF)]%%%%=v(@Salut",240601,239637,964,477,353,66364,292,94,95,0,0,Non Donors
4/5/2022,3:00:50 PM,1,Tax Day,2022-04-05-Tax-Day-E1-PNB,cultivation,"%%[ VAR @DefaultName, @Salutation Set @DefaultName = 'Friend' IF LENGTH([FirstName]) > 1 THEN Set @Salutation = Concat(ProperCase([FirstName])) ELSE set @Salutation = @DefaultName ENDIF)]%%%%=v(@Salut",342,342,0,2,2,142,1,0,0,0,0,PNB
4/18/2022,2:01:00 PM,1,Tax Day,2022-04-18-Tax-Day-13-37-Month-Donors,cultivation,"%%[ VAR @DefaultName, @Salutation Set @DefaultName = 'Friend' IF LENGTH([FirstName]) > 1 THEN Set @Salutation = Concat(ProperCase([FirstName])) ELSE set @Salutation = @DefaultName ENDIF)]%%%%=v(@Salut",122089,121838,251,167,125,45982,63,26,27,4,465,Lapsed Donors
3/9/2022,8:38:39 PM,1,Ukraine,2022-03-09-Ukraine-TY-Partner,engagement,Thank you for stepping up,1334,1329,5,16,11,468,1,0,0,7,1700,Partners
3/9/2022,8:40:34 PM,1,Ukraine,2022-03-09-Ukraine-TY-PNB,engagement,Thank you for stepping up,23,23,0,0,0,13,0,0,0,0,0,PNB
3/9/2022,5:30:43 PM,1,Ukraine,2022-03-09-Ukraine-TY-0-12-Month-Donor,engagement,Thank you for stepping up,2,2,0,0,0,1,0,0,0,27,1154,First Levels
3/9/2022,5:30:42 PM,1,Ukraine,2022-03-09-Ukraine-TY-Field-Partner,engagement,Thank you for stepping up,9,9,0,1,1,3,0,0,0,29,4150,Field Partners
3/9/2022,8:39:42 PM,1,Ukraine,2022-03-09-Ukraine-TY-Field-Partner,engagement,Thank you for stepping up,3716,3708,8,58,50,2153,0,0,0,29,4150,Field Partners
3/9/2022,5:30:39 PM,1,Ukraine,2022-03-09-Ukraine-TY-Moved-Majors,engagement,Thank you for stepping up,2,2,0,0,0,1,0,0,0,1,8000,Other
3/9/2022,8:38:43 PM,1,Ukraine,2022-03-09-Ukraine-TY-0-12-Month-Donor,engagement,Thank you for stepping up,10370,10245,125,109,85,5167,14,7,7,27,1154,First Levels
3/9/2022,5:30:39 PM,1,Ukraine,2022-03-09-Ukraine-TY-Partner,engagement,Thank you for stepping up,16,16,0,2,1,10,0,0,0,7,1700,Partners
3/9/2022,8:39:37 PM,1,Ukraine,2022-03-09-Ukraine-TY-Moved-Majors,engagement,Thank you for stepping up,43,43,0,2,1,31,0,0,0,1,8000,Other
3/24/2022,6:52:50 PM,1,Ukraine,2022-03-24-Ukraine-One-Month-0-12-Month-Donor,fundraising,One month of war in Ukraine,92244,92007,237,404,337,29244,58,23,23,139,13583,First Levels
3/24/2022,6:52:52 PM,1,Ukraine,2022-03-24-Ukraine-One-Month-13-37-Month-Donor,fundraising,One month of war in Ukraine,116450,116309,141,234,186,45301,44,18,22,50,20008,Lapsed Donors
3/24/2022,6:52:53 PM,1,Ukraine,2022-03-24-Ukraine-One-Month-Non-Donor,fundraising,One month of war in Ukraine,229056,228356,700,463,360,70614,188,52,52,30,2775,Non Donors
3/24/2022,6:46:40 PM,1,Ukraine,2022-03-24-Ukraine-One-Month-0-12-Month-Recent-Donors,fundraising,One month of war in Ukraine,19466,19384,82,190,156,8244,23,7,7,70,6470,First Levels
3/24/2022,7:50:36 PM,1,Ukraine,2022-03-24-Ukraine-One-Month-PNB,fundraising,Today: One month of war in Ukraine,323,321,2,1,1,153,0,0,0,0,0,PNB
3/24/2022,7:50:42 PM,1,Ukraine,2022-03-24-Ukraine-One-Month-Moved-Majors,fundraising,Today: One month of war in Ukraine,2071,2065,6,26,15,933,1,0,0,4,2450,Other
3/24/2022,7:50:40 PM,1,Ukraine,2022-03-24-Ukraine-One-Month-Field-Partners,fundraising,Today: One month of war in Ukraine,59275,59173,102,432,333,23721,33,12,12,0,0,Field Partners
3/7/2022,11:08:43 PM,4,Ukraine,2022-03-07-Ukraine-E4-Partner,engagement,Ukraine urgently needs medical supplies,14036,14009,27,560,416,5383,4,1,1,208,160330,Partners
3/7/2022,11:08:50 PM,4,Ukraine,2022-03-07-Ukraine-E4-Field-Partner,fundraising,Ukraine urgently needs medical supplies,57071,57014,57,1626,1272,23555,20,7,7,840,135381.72,Field Partners
3/7/2022,11:08:50 PM,4,Ukraine,2022-03-07-Ukraine-E4-0-12-Month-Donor,fundraising,Ukraine urgently needs medical supplies,95336,95160,176,1805,1400,33124,42,14,14,881,109035.54,First Levels
3/7/2022,11:08:53 PM,4,Ukraine,2022-03-07-Ukraine-E4-Non-Donors,fundraising,Ukraine urgently needs medical supplies,213927,213402,525,662,499,64419,98,19,19,151,15730,Non Donors
3/8/2022,3:00:43 PM,4,Ukraine,2022-03-07-Ukraine-E4-Legacy-Donors,engagement,Ukraine urgently needs medical supplies,2218,2212,6,152,125,1126,3,2,2,1,30,Other
3/7/2022,11:08:46 PM,4,Ukraine,2022-03-07-Ukraine-E4-PNB,engagement,Ukraine urgently needs medical supplies,315,315,0,13,10,136,0,0,0,3,3500,PNB
3/7/2022,11:08:45 PM,4,Ukraine,2022-03-07-Ukraine-E4-Moved-Majors,engagement,Ukraine urgently needs medical supplies,2036,2035,1,101,71,901,1,1,1,21,58150,Other
3/8/2022,3:00:43 PM,4,Ukraine,2022-03-07-Ukraine-E4-Major-Gifts,engagement,Ukraine urgently needs medical supplies,1072,1071,1,82,59,682,0,0,0,3,40000,Other
3/7/2022,11:08:54 PM,4,Ukraine,2022-03-07-Ukraine-E4-13-37-Month-Donor,fundraising,Ukraine urgently needs medical supplies,116322,116164,158,884,664,47268,46,18,19,339,48545,Lapsed Donors
3/8/2022,3:00:51 PM,4,Ukraine,2022-03-07-Ukraine-E4-Corporations,engagement,Ukraine urgently needs medical supplies,610,605,5,8,6,190,0,0,0,0,0,Other
2/26/2022,1:01:00 PM,1,Ukraine,2022-02-25-Ukraine-Non-Donors,fundraising,URGENT: An update from [NONPROFIT] teams in Ukraine,215787,215290,497,467,343,64531,131,28,28,67,5607,Non Donors
2/26/2022,1:00:58 PM,1,Ukraine,2022-02-25-Ukraine-0-12-Month-Donors,fundraising,URGENT: An update from [NONPROFIT] teams in Ukraine,106884,106652,232,1089,752,36274,66,25,25,402,36027.33,First Levels
2/26/2022,1:00:44 PM,1,Ukraine,2022-02-25-Ukraine-PNB,fundraising,URGENT: An update from [NONPROFIT] teams in Ukraine,334,334,0,5,4,150,0,0,0,2,1500,PNB
2/26/2022,1:00:48 PM,1,Ukraine,2022-02-25-Ukraine-Partner,fundraising,URGENT: An update from [NONPROFIT] teams in Ukraine,14990,14963,27,192,133,6361,5,2,2,75,39449,Partners
2/26/2022,1:00:59 PM,1,Ukraine,2022-02-25-Ukraine-13-37-Month-Donors,fundraising,URGENT: An update from [NONPROFIT] teams in Ukraine,126289,126105,184,406,320,49559,53,16,17,131,30539,Lapsed Donors
2/26/2022,1:00:49 PM,1,Ukraine,2022-02-25-Ukraine-Moved-Majors,fundraising,URGENT: An update from [NONPROFIT] teams in Ukraine,2137,2135,2,31,26,1033,1,1,1,9,23000,Other
2/26/2022,1:00:59 PM,1,Ukraine,2022-02-25-Ukraine-Field-Partner,fundraising,URGENT: An update from [NONPROFIT] teams in Ukraine,60346,60270,76,1094,864,25616,22,13,13,558,67336.95,Field Partners
2/26/2022,1:00:45 PM,1,Ukraine,2022-02-Ukraine-High-Touch,fundraising,URGENT: An update from [NONPROFIT] teams in Ukraine,3126,3117,9,157,130,1790,6,1,1,0,0,Other
3/1/2022,6:55:43 PM,2,Ukraine,2022-02-28-Ukraine-E2-Moved-Majors,fundraising,Ukraine update: [NONPROFIT] teams preparing response,2120,2119,1,57,39,984,1,1,1,19,29650,Other
3/1/2022,6:55:52 PM,2,Ukraine,2022-02-28-Ukraine-E2-13-37-Month-Donors,fundraising,Ukraine update: [NONPROFIT] teams preparing response,125756,125578,178,622,483,48597,47,19,20,232,34392,Lapsed Donors
3/1/2022,6:55:52 PM,2,Ukraine,2022-02-28-Ukraine-E2-Field-Partner,fundraising,Ukraine update: [NONPROFIT] teams preparing response,59547,59471,76,1126,873,24614,16,10,10,578,76656,Field Partners
3/1/2022,6:55:37 PM,2,Ukraine,2022-02-28-Ukraine-E2-PNB,fundraising,Ukraine update: [NONPROFIT] teams preparing response,328,328,0,9,5,148,1,1,1,3,2000,PNB
3/1/2022,6:54:57 PM,2,Ukraine,2022-02-28-Ukraine-E2-Non-Donors,fundraising,Ukraine update: [NONPROFIT] teams preparing response,213800,213309,491,479,377,64270,88,23,23,102,8503,Non Donors
3/1/2022,6:55:40 PM,2,Ukraine,2022-02-28-Ukraine-E2-Partner,fundraising,Ukraine update: [NONPROFIT] teams preparing response,14795,14768,27,283,222,6103,4,1,1,114,74400,Partners
3/1/2022,6:56:37 PM,2,Ukraine,2022-02-28-Ukraine-E2-Legacy-Donors,fundraising,Ukraine update: [NONPROFIT] teams preparing response,2123,2118,5,114,95,1058,4,3,3,0,0,Other
3/1/2022,6:54:50 PM,2,Ukraine,2022-02-28-Ukraine-E2-0-12-Month-Donor,fundraising,Ukraine update: [NONPROFIT] teams preparing response,105380,105158,222,1478,1101,35285,45,22,22,664,68605.72,First Levels
3/15/2022,12:00:56 PM,1,Ukraine,2022-03-15-Ukraine-Sustainer-Match-E1-13-37-Month-Donor,fundraising,[MATCH] Double your impact with a monthly gift,115838,115698,140,146,118,44361,53,17,20,8,280,Lapsed Donors
3/15/2022,12:00:49 PM,1,Ukraine,2022-03-15-Ukraine-Sustainer-Match-E1-0-12-Month-Recent-Donors,fundraising,[MATCH] Double your impact with a monthly gift,14514,14458,56,121,91,6747,44,7,7,6,155,First Levels
3/15/2022,12:00:56 PM,1,Ukraine,2022-03-15-Ukraine-Sustainer-Match-E1-0-12-Month-Donor,fundraising,[MATCH] Double your impact with a monthly gift,94874,94593,281,231,179,29557,60,21,21,21,850,First Levels
3/15/2022,12:00:57 PM,1,Ukraine,2022-03-15-Ukraine-Sustainer-Match-E1-Non-Donor,fundraising,[MATCH] Double your impact with a monthly gift,227391,226712,679,481,331,64271,223,53,53,5,110,Non Donors
3/22/2022,10:52:41 PM,1,Ukraine,2022-03-22-Ukraine-Moldova-0-12-Month-Recent-Donors,engagement,Providing care to Ukrainian refugees in Moldova,19502,19413,89,371,305,9963,21,10,10,72,6537,First Levels
3/22/2022,10:51:49 PM,1,Ukraine,2022-03-22-Ukraine-Moldova-0-12-Month-Donor,engagement,Providing care to Ukrainian refugees in Moldova,92638,92382,256,739,601,30839,41,14,14,265,38558.02,First Levels
3/22/2022,10:50:55 PM,1,Ukraine,2022-03-22-Ukraine-Moldova-Non-Donor,engagement,Providing care to Ukrainian refugees in Moldova,229552,228834,718,503,381,65750,133,41,41,58,4350,Non Donors
3/22/2022,10:50:55 PM,1,Ukraine,2022-03-22-Ukraine-Moldova-13-37-Month-Donor,engagement,Providing care to Ukrainian refugees in Moldova,116447,116299,148,309,249,44782,31,7,11,82,9850,Lapsed Donors
3/10/2022,7:00:58 PM,5,Ukraine,2022-03-10-Ukraine-E5-Non-Donors,fundraising,[Latest Update] First Shipment of Supplies Arrives in Ukraine,213387,212815,572,591,463,64432,103,24,24,131,14272,Non Donors
3/10/2022,7:00:55 PM,5,Ukraine,2022-03-10-Ukraine-E5-Field-Partner,fundraising,[Latest Update] First Shipment of Supplies Arrives in Ukraine,56132,56076,56,820,646,22551,18,6,6,402,79836,Field Partners
3/10/2022,7:00:57 PM,5,Ukraine,2022-03-10-Ukraine-E5-13-37-Month-Donor,fundraising,[Latest Update] First Shipment of Supplies Arrives in Ukraine,116007,115855,152,494,414,45833,49,17,19,241,54060,Lapsed Donors
3/10/2022,7:01:36 PM,5,Ukraine,2022-03-10-Ukraine-E5-0-12-Month-Donor,fundraising,[Latest Update] First Shipment of Supplies Arrives in Ukraine,94733,94544,189,1206,980,32321,45,17,17,637,78199.68,First Levels
3/15/2022,4:00:48 PM,1,Ukraine,2022-03-15-Ukraine-Update-Moved-Majors,engagement,Re: [NONPROFIT] is in a race against time to supply hospitals in Ukraine,2120,2118,2,72,40,939,0,0,0,10,28100,Other
3/15/2022,4:00:42 PM,1,Ukraine,2022-03-15-Ukraine-Update-PNB,engagement,Re: [NONPROFIT] is in a race against time to supply hospitals in Ukraine,336,335,1,11,8,155,0,0,0,6,20400,PNB
3/15/2022,4:00:56 PM,1,Ukraine,2022-03-15-Ukraine-Update-Field-Partner,engagement,Re: [NONPROFIT] is in a race against time to supply hospitals in Ukraine,60524,60466,58,1399,1059,24617,18,5,5,453,78678.5,Field Partners
3/15/2022,4:00:46 PM,1,Ukraine,2022-03-15-Ukraine-Update-Partner,engagement,Re: [NONPROFIT] is in a race against time to supply hospitals in Ukraine,15181,15161,20,444,311,6058,1,0,0,130,69100,Partners
3/4/2022,4:00:42 PM,3,Ukraine,2022-03-03-Ukraine-E3-Corporations,fundraising,[Ukraine] Response efforts are underway in and around the country,572,562,10,13,7,222,1,0,0,0,0,Other
3/3/2022,10:42:39 PM,3,Ukraine,2022-03-03-Ukraine-E3-Partner,fundraising,[Ukraine] Response efforts are underway in and around the country,14565,14541,24,321,235,5967,4,1,1,131,88995,Partners
3/4/2022,4:00:39 PM,3,Ukraine,2022-03-03-Ukraine-E3-Major-Gifts,Fundraising,[Ukraine] Response efforts are underway in and around the country,946,945,1,59,48,617,0,0,0,0,0,Other
3/3/2022,10:42:46 PM,3,Ukraine,2022-03-03-Ukraine-E3-PNB,fundraising,[Ukraine] Response efforts are underway in and around the country,320,320,0,8,8,151,0,0,0,3,2100,PNB
3/3/2022,10:41:55 PM,3,Ukraine,2022-03-03-Ukraine-E3-Non-Donors,fundraising,[Ukraine] Response efforts are underway in and around the country,212930,212454,476,497,351,62366,83,26,26,71,7283,Non Donors
3/4/2022,4:00:38 PM,3,Ukraine,2022-03-03-Ukraine-E3-Legacy-Donors,fundraising,[Ukraine] Response efforts are underway in and around the country,2084,2080,4,116,84,1025,2,1,1,0,0,Other
3/3/2022,10:41:55 PM,3,Ukraine,2022-03-03-Ukraine-E3-13-37-Month-Donor,fundraising,[Ukraine] Response efforts are underway in and around the country,116728,116577,151,543,422,46062,43,17,18,182,21621,Lapsed Donors
3/3/2022,10:45:42 PM,3,Ukraine,2022-03-03-Ukraine-E3-Field-Partner,fundraising,[Ukraine] Response efforts are underway in and around the country,58790,58735,55,1078,841,23898,19,9,9,545,89374,Field Partners
3/3/2022,10:47:42 PM,3,Ukraine,2022-03-03-Ukraine-E3-Moved-Majors,fundraising,[Ukraine] Response efforts are underway in and around the country,2087,2086,1,55,37,1000,1,0,0,19,47200,Other
3/17/2022,12:00:55 PM,2,Ukraine,2022-03-17-Ukraine-Sustainer-Match-E2-0-12-Month-Donor,fundraising,Support our teams in emergencies like Ukraine and around the world,93796,93548,248,350,278,30085,61,26,26,101,9211,First Levels
3/17/2022,12:00:48 PM,2,Ukraine,2022-03-17-Ukraine-Sustainer-Match-E2-0-12-Month-Recent-Donors,fundraising,Support our teams in emergencies like Ukraine and around the world,19308,19221,87,141,102,9122,43,11,11,5,80,First Levels
3/17/2022,12:00:58 PM,2,Ukraine,2022-03-17-Ukraine-Sustainer-Match-E2-13-37-Month-Donor,fundraising,Support our teams in emergencies like Ukraine and around the world,115723,115597,126,191,146,44986,47,24,28,21,1085,Lapsed Donors
3/17/2022,12:00:58 PM,2,Ukraine,2022-03-17-Ukraine-Sustainer-Match-E2-Non-Donor,fundraising,Support our teams in emergencies like Ukraine and around the world,231654,230986,668,357,264,66516,204,56,56,9,330,Non Donors
5/19/2022,6:03:43 PM,1,Ukraine,2022-05-19-Ukraine-Update-Moved-Major,engagement,"Ukraine Update: Emergency medical supplies, train evacuations, mobile clinics, and more",1698,1696,2,13,8,725,0,0,0,1,1000,Other
5/19/2022,4:24:40 PM,1,Ukraine,2022-05-19-Ukraine-Update-Field-Partner-A,engagement,"Ukraine Update: Emergency medical supplies, train evacuations, mobile clinics, and more",29489,29460,29,172,136,11164,13,5,5,48,5860,Field Partners
5/19/2022,6:03:47 PM,1,Ukraine,2022-05-19-Ukraine-Update-DONOR-First-Level,engagement,"Ukraine Update: Emergency medical supplies, train evacuations, mobile clinics, and more",21301,21276,25,158,108,8523,18,5,5,13,1370,Other
5/19/2022,4:23:53 PM,1,Ukraine,2022-05-19-Ukraine-Update-13-37-Month-Donors-B,engagement,"Ukraine Update: Emergency medical supplies, train evacuations, mobile clinics, and more",61326,61231,95,202,100,22019,20,4,4,23,14010,Lapsed Donors
5/19/2022,4:23:53 PM,1,Ukraine,2022-05-19-Ukraine-Update-13-37-Month-Donors-A,engagement,"Ukraine Update: Emergency medical supplies, train evacuations, mobile clinics, and more",61609,61529,80,233,90,22107,29,11,13,15,1761,Lapsed Donors
5/19/2022,4:23:54 PM,1,Ukraine,2022-05-19-Ukraine-Update-Non-Donors-A,engagement,"Ukraine Update: Emergency medical supplies, train evacuations, mobile clinics, and more",122441,122198,243,239,178,32615,67,17,17,10,1500,Non Donors
5/19/2022,6:04:35 PM,1,Ukraine,2022-05-19-Ukraine-Update-DONOR-Partner,engagement,"Ukraine Update: Emergency medical supplies, train evacuations, mobile clinics, and more",892,891,1,8,8,396,0,0,0,1,500,Partners
5/19/2022,4:23:53 PM,1,Ukraine,2022-05-19-Ukraine-Update-0-12-Month-Donors-B,engagement,"Ukraine Update: Emergency medical supplies, train evacuations, mobile clinics, and more",55402,55266,136,383,203,16855,15,6,6,74,5715,First Levels
5/19/2022,6:03:48 PM,1,Ukraine,2022-05-19-Ukraine-Update-Field-Partner-B,engagement,"Ukraine Update: Emergency medical supplies, train evacuations, mobile clinics, and more",29512,29483,29,175,131,11154,14,7,7,30,3980,Field Partners
5/19/2022,6:03:46 PM,1,Ukraine,2022-05-19-Ukraine-Update-Partner,engagement,"Ukraine Update: Emergency medical supplies, train evacuations, mobile clinics, and more",15129,15105,24,97,71,5681,11,4,4,24,16800,Partners
5/19/2022,6:03:43 PM,1,Ukraine,2022-05-19-Ukraine-Update-PNB,engagement,"Ukraine Update: Emergency medical supplies, train evacuations, mobile clinics, and more",334,334,0,2,2,144,0,0,0,1,500,PNB
5/19/2022,4:23:50 PM,1,Ukraine,2022-05-19-Ukraine-Update-0-12-Month-Donors-A,engagement,"Ukraine Update: Emergency medical supplies, train evacuations, mobile clinics, and more",55212,55084,128,315,199,16756,26,9,9,63,5800,First Levels
5/19/2022,4:24:52 PM,1,Ukraine,2022-05-19-Ukraine-Update-Non-Donors-B,engagement,"Ukraine Update: Emergency medical supplies, train evacuations, mobile clinics, and more",122610,122336,274,224,177,32482,61,7,7,10,390,Non Donors
2/25/2021,3:00:47 PM,1,Unknown,2021.02.25 Mary Farewell,Unknown,Leaving [NONPROFIT],74,74,0,0,0,58,1,0,0,0,0,Other
5/29/2021,2:00:52 PM,1,Unknown,May 2021 Enews - FP and Partners,Unknown,Vaccines work,67027,66968,59,618,475,10898,20,3,3,0,0,Partners
5/29/2021,2:01:37 PM,1,Unknown,May 2021 Enews - Hightouch,Unknown,Vaccines work,214394,213299,1095,1951,968,13867,308,45,45,0,0,Other
5/29/2021,2:01:01 PM,1,Unknown,May 2021 Enews - FL and Non Donors - 20210528_114957 - 20210528_101450,Unknown,Vaccines work,330129,329782,347,1476,924,39999,240,29,30,0,0,Other
5/17/2022,10:02:35 PM,1,Unknown,MK Test Email,Unknown,Hello from Me!,2,2,0,0,0,2,2,0,0,0,0,Other
5/17/2022,10:12:37 PM,1,Unknown,MK Test Email,Unknown,Hello from Me!,1,1,0,0,0,1,1,0,0,0,0,Other
12/14/2020,11:35:41 PM,1,Unknown,jtk695-Mid-month fundraiser #1-nd,Unknown,COVID-19 in Yemen,5379,4484,895,18,11,781,3,0,0,0,0,Other
12/16/2020,6:00:38 PM,1,Unknown,jtk703 - CLONE - Mid-month fundraiser #1 GMAIL - partners,Unknown,COVID-19 in Yemen,20,14,6,0,0,4,0,0,0,0,0,Partners
12/14/2020,11:30:42 PM,1,Unknown,jtk695-Mid-month fundraiser #1-d,Unknown,COVID-19 in Yemen,8792,7403,1389,40,27,1475,2,0,0,0,0,Other
10/12/2020,5:29:50 PM,1,Unknown,2020.10.12 October Insider,Unknown,[NONPROFIT] Insider Update,737,731,6,4,3,364,3,0,0,0,0,Other
1/4/2021,3:00:43 PM,1,Unknown,jtk700-Thank you - Donor with codes,Unknown,Our sincere thanks,412,408,4,7,2,169,0,0,0,0,0,Other
1/4/2021,3:00:46 PM,1,Unknown,jtk700-Thank you - non-donor with codes,Unknown,Our sincere thanks,14582,14548,34,50,41,3815,10,3,3,0,0,Non Donors
8/16/2021,2:00:34 PM,1,Unknown,2021-08-[NONPROFIT]-way-E3-0-12-month-donors-seed,Unknown,How we bear witness,16,16,0,1,1,12,0,0,0,0,0,First Levels
12/22/2021,7:56:35 PM,1,Unknown,201 50th Anniversary Email,Unknown,[NONPROFIT] Marks 50 Years!,917,911,6,1,1,531,2,0,0,0,0,Other
5/29/2022,2:00:55 PM,1,Unknown,May 2022 Enews - FL and ND,Unknown,Measles cases surge,483989,482764,1225,2260,1393,146769,576,103,103,0,0,Other
5/29/2022,2:00:54 PM,1,Unknown,May 2022 Enews - FP + ML,Unknown,Measles cases surge,80667,80560,107,690,451,29699,39,14,14,0,0,Other
5/29/2022,2:01:05 PM,1,Unknown,May 2022 Enews - HV,Unknown,Measles cases surge,188701,187234,1467,261,150,4288,77,17,17,0,0,Other
3/23/2022,3:34:50 PM,1,Unknown,2022 March Flash Briefing Sorry,Unknown,Sorry We Missed You!,7,7,0,3,2,6,0,0,0,0,0,Other
10/30/2020,6:03:03 PM,1,Unknown,2019 Annual Report,Unknown,Our 2019 Annual Report,1647,1632,15,142,109,769,9,1,1,0,0,Other
11/23/2020,4:10:35 PM,1,Unknown,2020-11-Estates-Annual-Report,Unknown,Our 2019 Annual Report,24,22,2,26,7,6,0,0,0,0,0,Other
10/30/2020,6:04:43 PM,1,Unknown,2019 Annual Report to Legacy Donors,Unknown,Our 2019 Annual Report,2062,2024,38,67,56,722,10,3,3,0,0,Other
11/19/2020,10:00:43 PM,1,Unknown,2020-11-Estates-Annual-Report,Unknown,Our 2019 Annual Report,1,1,0,0,0,1,0,0,0,0,0,Other
11/9/2021,10:00:41 PM,1,Unknown,2021-11-Estates-Annual-Report,Unknown,Our 2020 Annual Report,14,14,0,4,1,3,0,0,0,0,0,Other
9/14/2021,4:34:34 PM,1,Unknown,2021 September Donor Roundtable Renewal TY,Unknown,Thank You and a Request,10,10,0,0,0,8,0,0,0,0,0,Other
6/23/2022,4:00:41 PM,1,Unknown,2022-06- CFC-Special_Solicitation,Unknown,CFC Special Solicitation,1168,1163,5,2,2,395,1,0,0,0,0,Other
7/14/2022,2:00:51 PM,1,Unknown,2022 June Insider_ Legacy Donors,Unknown,My Assignment in Ukraine,225,217,8,0,0,82,0,0,0,0,0,Other
7/14/2022,2:00:51 PM,1,Unknown,2022 June Insider_ Major Donors,Unknown,My Assignment in Ukraine,244,244,0,0,0,175,0,0,0,0,0,Other
3/23/2022,3:31:39 PM,1,Unknown,2022 March Flash Briefing TY,Unknown,Thank You for Attending!,12,12,0,4,2,10,0,0,0,0,0,Other
4/8/2022,9:10:41 PM,1,Unknown,2022 Apr Flash Briefing Thank You,Unknown,Thank You for Attending!,24,24,0,2,1,19,0,0,0,0,0,Other
3/4/2022,7:38:37 PM,1,Unknown,2022 March COVID Webinar Major Gifts TY,Unknown,Thank You for Attending!,5,5,0,0,0,5,0,0,0,0,0,Other
11/17/2021,9:32:40 PM,1,Unknown,2021 November Donor Roundtable Thank You Major Gifts,Unknown,Thank You for Attending!,21,21,0,1,1,14,0,0,0,0,0,Other
3/24/2021,4:18:40 PM,1,Unknown,Q1 Brittani Thank You Email,Unknown,Thank You for Your Gift!,374,368,6,2,2,207,2,0,0,0,0,Other
5/13/2021,3:51:42 PM,1,Unknown,Q2 Email TYs,Unknown,Thank You for Your Gift!,313,313,0,0,0,194,0,0,0,0,0,Other
5/6/2022,7:56:35 PM,1,Unknown,2022 May Flash Briefing TY,Unknown,Thank you for Attending!,11,11,0,5,3,10,0,0,0,0,0,Other
12/31/2020,1:00:51 AM,1,Unknown,2020-12-Final-Stretch-E10-Field-Partner,Unknown,Can I be honest with you?,58090,58056,34,382,315,11908,52,11,11,108,24899.12,Field Partners
12/31/2020,1:00:41 AM,1,Unknown,2020-12-Final-Stretch-E10-Standard-Partner,Unknown,Can I be honest with you?,13755,13735,20,111,95,3173,11,6,6,36,17690,Partners
12/15/2020,11:30:42 PM,1,Unknown,jtk696-Mid-month fundraiser #2-2020 nd,Unknown,Re: our response in Syria,4453,4447,6,8,8,764,2,1,1,0,0,Other
12/15/2020,11:30:40 PM,1,Unknown,jtk696-Mid-month fundraiser #2-2020 d,Unknown,Re: our response in Syria,7400,7387,13,37,32,1550,4,0,0,0,0,Other
12/17/2020,3:40:36 PM,1,Unknown,jtk704-Mid-month fundraiser #2-GMAIL,Unknown,Re: our response in Syria,26,22,4,0,0,12,0,0,0,0,0,Other
4/11/2022,4:15:37 PM,1,Unknown,2022-04-E2-Survey-Invite-No-One-Time-Gift,Unknown,We want to hear from you!,3,3,0,0,0,3,0,0,0,0,0,Other
4/6/2022,7:00:48 PM,1,Unknown,2022-04-E2-Survey-Invite-Pledges,Unknown,We want to hear from you!,851,847,4,22,16,382,4,1,1,0,0,Other
4/6/2022,7:00:45 PM,1,Unknown,2022-04-E2-Survey-Invite-No-One-Time-Gift,Unknown,We want to hear from you!,6813,6788,25,72,62,2781,10,2,2,0,0,Other
4/6/2022,7:00:45 PM,1,Unknown,2022-04-E2-Survey-Invite-One-Time-Gift,Unknown,We want to hear from you!,8833,8809,24,148,117,3857,16,2,2,0,0,Other
4/6/2022,7:00:45 PM,1,Unknown,2022-04-E2-Survey-Invite-DAF-IRA-STOCK,Unknown,We want to hear from you!,3694,3681,13,65,60,1696,9,3,3,0,0,Other
6/22/2022,4:00:55 PM,1,Unknown,ML Insights Survey Monthly 2022 June - Initial,Unknown,Your Insight Panel survey,413,413,0,58,54,248,0,0,0,0,0,Other
4/26/2022,5:40:42 PM,1,Unknown,2022 Apr Renewal Current Donors,Unknown,Please Renew Your Support!,64,64,0,1,1,41,0,0,0,0,0,Other
4/26/2022,5:44:36 PM,1,Unknown,2022 Apr Renewal Lapsing Donors,Unknown,Please Renew Your Support!,6,6,0,9,1,5,0,0,0,0,0,Other
3/28/2022,5:33:38 PM,1,Unknown,Partner Welcome Journey #2 - 2021,Unknown,Now that you?re our Partner,80,79,1,5,3,32,0,0,0,0,0,Partners
6/2/2022,5:23:49 PM,1,Unknown,Partner Welcome Journey #2 - 2021,Unknown,Now that you?re our Partner,2,2,0,0,0,1,0,0,0,0,0,Partners
10/1/2020,5:38:44 PM,1,Unknown,Partner Welcome Journey #2,Unknown,Now that you?re our Partner,1797,1775,22,71,63,533,10,1,1,0,0,Partners
1/29/2022,6:32:36 PM,1,Unknown,Partner Welcome Journey #2 - 2021,Unknown,Now that you?re our Partner,132,130,2,6,5,53,1,0,0,0,0,Partners
10/26/2021,10:00:42 PM,1,Unknown,2021-10-Annual_Federated_Giving_Thanks,Unknown,Thank you for your support!,1303,1241,62,10,9,361,5,1,1,0,0,Other
7/19/2021,5:00:44 PM,1,Unknown,2021-07-Major-gifts-to-midlevel-E1-Partner,engagement,Allow me to introduce myself,2615,2589,26,25,21,1092,12,3,3,6,37500,Partners
7/19/2021,5:00:39 PM,1,Unknown,2021-07-Major-gifts-to-midlevel-E1-Partner - 20210715_160210,Unknown,Allow me to introduce myself,6,6,0,2,1,3,0,0,0,0,0,Partners
10/1/2020,3:05:34 PM,1,Unknown,jtk362 New Email Journey 3 of 3,Unknown,What does $10 make possible?,5910,5839,71,148,93,1373,27,4,4,0,0,Other
9/15/2021,3:03:44 PM,1,Unknown,jtk362 New Email Journey 3 of 3 - 2021,Unknown,What does $10 make possible?,417,405,12,2,2,49,0,0,0,0,0,Other
9/15/2021,3:03:39 PM,1,Unknown,jtk362 New Email Journey 3 of 3 - 2021,Unknown,What does $10 make possible?,633,621,12,6,6,153,7,2,2,0,0,Other
10/1/2020,3:09:48 PM,1,Unknown,jtk362 New Email Journey 3 of 3,Unknown,What does $10 make possible?,3782,3708,74,44,37,413,17,2,2,0,0,Other
12/18/2021,3:00:57 PM,1,Unknown,December 2021 Enews- FL and Nondonors,Unknown,[NONPROFIT]: 50 years of speaking out,460442,459526,916,1671,1273,123632,661,77,77,0,0,Other
12/18/2021,3:01:07 PM,1,Unknown,December 2021 Enews- High Touch,Unknown,[NONPROFIT]: 50 years of speaking out,161337,160360,977,159,119,5562,77,13,14,0,0,Other
12/18/2021,3:00:57 PM,1,Unknown,December 2021 Enews- FP+Partner,Unknown,[NONPROFIT]: 50 years of speaking out,73550,73473,77,560,425,24742,49,9,9,0,0,Partners
11/9/2020,11:35:45 PM,1,Unknown,2020-11-Partner-Stock-Market-PNB,Unknown,Market highs ? Maximum impact,180,180,0,1,1,38,0,0,0,0,0,Partners
11/9/2020,11:35:49 PM,1,Unknown,2020-11-Partner-Stock-Market-Partners,Unknown,Market highs ? Maximum impact,14997,14971,26,47,35,3171,18,4,4,0,0,Partners
4/8/2022,9:12:40 PM,1,Unknown,2022 Apr Flash Briefing Sorry We Missed You,Unknown,Recap of [NONPROFIT] Ukraine Briefing,6,6,0,5,2,6,0,0,0,0,0,Other
11/2/2020,10:15:44 PM,1,Unknown,jtk687 - FWD Ways to Give - PNB,Unknown,Did you see Tiffany?s message?,91,91,0,0,0,18,0,0,0,0,0,PNB
11/2/2020,10:15:45 PM,1,Unknown,jtk687 - FWD Ways to Give - partners,Unknown,Did you see Tiffany?s message?,7523,7507,16,52,26,1778,7,1,1,0,0,Partners
11/2/2020,10:15:45 PM,1,Unknown,jtk687 - FWD Ways to Give - partners,Unknown,Did you see Tiffany?s message?,7522,7509,13,42,33,1579,13,8,8,0,0,Partners
11/2/2020,10:15:44 PM,1,Unknown,jtk687 - FWD Ways to Give - PNB,Unknown,Did you see Tiffany?s message?,90,90,0,0,0,19,1,0,0,0,0,PNB
11/17/2021,9:38:41 PM,1,Unknown,2021 November Donor Roundtable Sorry We Missed You,Unknown,Sorry We Missed You Yesterday!,957,913,44,52,45,482,6,0,0,0,0,Other
12/18/2020,3:00:43 PM,1,Unknown,jtk705-Mid-month fundraiser #3-gmail,Unknown,"42,000+ people forced from home",33,30,3,0,0,15,0,0,0,0,0,Other
12/16/2020,11:30:43 PM,1,Unknown,jtk697-Mid-month fundraiser #3-nd,Unknown,"42,000+ people forced from home",4309,4308,1,22,19,693,3,0,0,0,0,Other
12/16/2020,11:30:42 PM,1,Unknown,jtk697-Mid-month fundraiser #3-d,Unknown,"42,000+ people forced from home",7549,7536,13,45,35,1485,9,0,0,0,0,Other
11/16/2021,3:26:39 PM,1,Unknown,2021 No Roundtable Registered Reminder,Unknown,Reminder: [NONPROFIT] Roundtable Today!,40,40,0,0,0,33,0,0,0,0,0,Other
10/29/2021,2:00:46 PM,1,Unknown,2021-10-Sustainer-appeal-E3-0-12-month-donors-seed,Unknown,Don't forget to claim your tote!,20,20,0,0,0,13,0,0,0,0,0,First Levels
1/3/2022,9:00:51 PM,1,Unknown,2021-12-final-stretch-TY-13-37-month-donors,Unknown,Feeling hopeful in this new year,131728,131555,173,301,219,40770,79,13,14,2,35,Lapsed Donors
1/3/2022,9:00:36 PM,1,Unknown,2021-12-final-stretch-TY-Moved-Majors,Unknown,Feeling hopeful in this new year,29,29,0,0,0,16,0,0,0,0,0,Other
1/3/2022,9:00:38 PM,1,Unknown,2021-12-final-stretch-TY-Partner,Unknown,Feeling hopeful in this new year,1590,1581,9,6,4,673,2,0,0,0,0,Partners
1/3/2022,9:00:52 PM,1,Unknown,2021-12-final-stretch-TY-Non-Donors,Unknown,Feeling hopeful in this new year,232730,232198,532,435,373,52870,182,14,14,1,50,Non Donors
1/3/2022,9:00:39 PM,1,Unknown,2021-12-final-stretch-TY-Field-Partner,Unknown,Feeling hopeful in this new year,717,714,3,4,4,341,0,0,0,0,0,Field Partners
1/3/2022,9:00:36 PM,1,Unknown,2021-12-final-stretch-TY-PNB,Unknown,Feeling hopeful in this new year,21,21,0,0,0,13,0,0,0,0,0,PNB
1/3/2022,9:00:42 PM,1,Unknown,2021-12-final-stretch-TY-0-12-month-donors,Unknown,Feeling hopeful in this new year,9415,9337,78,43,41,2979,11,1,1,2,112,First Levels
12/3/2021,8:00:52 PM,1,Unknown,2021-11-Giving-Week-e12-13-37-month-donors,Unknown,I'm floored %%=v(@Salutation)=%%,126304,126127,177,291,240,40109,113,23,23,0,0,Lapsed Donors
11/18/2020,6:17:45 PM,1,Unknown,2020.11.17 Fall Renewal Current,Unknown,Please Renew Your Support of [NONPROFIT],317,316,1,34,23,138,0,0,0,0,0,Other
11/18/2020,6:18:40 PM,1,Unknown,2020.11.17 Fall Renewal Lapsing,Unknown,Please Renew Your Support of [NONPROFIT],52,52,0,3,3,17,0,0,0,0,0,Other
5/4/2021,7:54:35 PM,1,Unknown,2021.05.04 Spring Renewal Current,Unknown,Please Renew your Support of [NONPROFIT],329,329,0,19,16,166,0,0,0,0,0,Other
5/4/2021,9:10:39 PM,1,Unknown,2021.05.04 Spring Renewal New Donor,Unknown,Please Renew your Support of [NONPROFIT],6,6,0,0,0,3,0,0,0,0,0,Other
11/23/2020,11:30:41 PM,1,Unknown,jtk690 - Season of Gratitude Series #1 (and #2) - Partners,Unknown,Reaching out before the holidays,15002,14972,30,135,108,3300,13,5,5,0,0,Partners
11/23/2020,11:30:39 PM,1,Unknown,jtk690 - Season of Gratitude Series #1 (and #2) - PNB,Unknown,Reaching out before the holidays,185,184,1,1,1,41,0,0,0,0,0,PNB
2/17/2021,5:01:40 PM,1,Unknown,2021.02.17 Kim's TY For Patience,Unknown,Thank you for your 2020 support!,4050,4007,43,0,0,2303,5,3,3,0,0,Other
10/13/2021,2:00:45 PM,1,Unknown,2021-10-Malnutrition-goal-E2-0-12-month-donors-seed,Unknown,"We?re $35,215 away from our goal",20,20,0,0,0,12,0,0,0,0,0,First Levels
2/12/2021,7:03:46 PM,1,Unknown,2021-02-Give-a-mask-E2-Covid-donors,Unknown,Did you claim your face mask yet?,20596,20563,33,192,167,4159,8,0,0,0,0,Other
11/23/2021,3:00:49 PM,1,Unknown,2021 Fall Renewal Lapsing Version,Unknown,Please Renew Your Support to [NONPROFIT]!,6,5,1,0,0,2,0,0,0,0,0,Other
11/23/2021,3:00:50 PM,1,Unknown,2021 Fall Renewal Current Version,Unknown,Please Renew Your Support to [NONPROFIT]!,98,98,0,4,3,60,0,0,0,0,0,Other
4/7/2022,2:20:51 PM,1,Unknown,2022 Apr Flash Briefing Reminder- Avril in Ukraine,Unknown,Today: Live Briefing from Ukraine,1197,1194,3,47,39,759,4,0,0,0,0,Other
4/26/2022,10:00:56 PM,1,Unknown,2022-05 May Virtual Mapathon Invitation,Unknown,Join our Virtual Mapathon on May 4,549026,547703,1323,1758,1164,167494,514,104,104,0,0,Other
4/27/2022,5:46:38 PM,1,Unknown,2022-05 May Virtual Mapathon Invitation,Unknown,Join our Virtual Mapathon on May 4,3,3,0,0,0,3,0,0,0,0,0,Other
5/1/2021,2:00:39 PM,1,Unknown,2021-05 May Virtual Mapathon Invitation - 20210506,Unknown,Join our virtual Mapathon on May 6,931,920,11,136,74,337,2,0,0,0,0,Other
3/24/2022,7:50:39 PM,1,Unknown,2022-03-24-One-Month-Partner,Unknown,Today: One month of war in Ukraine,14672,14641,31,85,67,5740,5,2,2,0,0,Partners
5/17/2022,2:55:47 PM,1,Unknown,jtk360 New Email Journey 1 of 3  - 2021 - ROLLING,Unknown,Welcome to [NONPROFIT],1,1,0,0,0,0,0,0,0,0,0,Other
5/26/2022,4:05:41 PM,1,Unknown,2020-09-New-Field-Partner-Welcome-Email-1 - 2022,Unknown,Welcome to [NONPROFIT],68,68,0,2,1,27,0,0,0,0,0,Field Partners
6/16/2022,4:05:50 PM,1,Unknown,2020-09-New-Field-Partner-Welcome-Email-1 - 2022,Unknown,Welcome to [NONPROFIT],1448,1397,51,50,36,587,2,0,0,0,0,Field Partners
2/3/2022,6:04:41 PM,1,Unknown,jtk363 New Donor Journey 1 of 4 - 2021 - ROLLING,Unknown,Welcome to [NONPROFIT],6394,6341,53,146,99,3223,50,7,7,0,0,Other
6/10/2022,3:06:32 PM,1,Unknown,jtk360 New Email Journey 1 of 3  - 2021 - ROLLING,Unknown,Welcome to [NONPROFIT],13,13,0,2,1,5,0,0,0,0,0,Other
11/4/2021,3:03:57 PM,1,Unknown,jtk360 New Email Journey 1 of 3  - 2021 - ROLLING,Unknown,Welcome to [NONPROFIT],738,728,10,84,56,306,3,1,1,0,0,Other
9/15/2021,3:03:38 PM,1,Unknown,jtk360 New Email Journey 1 of 3  - 2021,Unknown,Welcome to [NONPROFIT],649,635,14,89,51,228,5,1,1,0,0,Other
9/15/2021,5:03:48 PM,1,Unknown,jtk363 New Donor Journey 1 of 4 - 2021,Unknown,Welcome to [NONPROFIT],1602,1576,26,36,29,547,21,3,3,0,0,Other
3/10/2022,7:04:49 PM,1,Unknown,2020-09-New-Field-Partner-Welcome-Email-1 - 2022,Unknown,Welcome to [NONPROFIT],129,128,1,2,2,63,0,0,0,0,0,Field Partners
3/29/2022,5:05:40 PM,1,Unknown,jtk363 New Donor Journey 1 of 4 - 2021 - ROLLING,Unknown,Welcome to [NONPROFIT],3900,3871,29,85,61,1803,35,3,3,0,0,Other
5/9/2022,5:01:32 PM,1,Unknown,jtk360 New Email Journey 1 of 3  - 2021 - ROLLING,Unknown,Welcome to [NONPROFIT],1,1,0,0,0,0,0,0,0,0,0,Other
5/11/2022,4:16:40 PM,1,Unknown,jtk363 New Donor Journey 1 of 4 - 2021 - ROLLING,Unknown,Welcome to [NONPROFIT],4,4,0,0,0,4,0,0,0,0,0,Other
5/21/2022,3:06:41 PM,1,Unknown,jtk363 New Donor Journey 1 of 4 - 2021 - ROLLING,Unknown,Welcome to [NONPROFIT],919,896,23,20,18,408,7,0,0,0,0,Other
4/21/2022,4:06:33 PM,1,Unknown,2020-09-New-Field-Partner-Welcome-Email-1 - 2022,Unknown,Welcome to [NONPROFIT],94,94,0,0,0,46,0,0,0,0,0,Field Partners
6/14/2022,5:24:42 PM,1,Unknown,2020-09-New-Field-Partner-Welcome-Email-1 - 2022,Unknown,Welcome to [NONPROFIT],3,3,0,0,0,2,0,0,0,0,0,Field Partners
5/6/2022,12:10:39 PM,1,Unknown,jtk360 New Email Journey 1 of 3  - 2021 - ROLLING,Unknown,Welcome to [NONPROFIT],2,2,0,0,0,2,0,0,0,0,0,Other
6/9/2022,12:25:43 PM,1,Unknown,jtk363 New Donor Journey 1 of 4 - 2021 - ROLLING,Unknown,Welcome to [NONPROFIT],1,1,0,0,0,1,0,0,0,0,0,Other
10/1/2020,3:04:58 PM,1,Unknown,jtk360 New Email Journey 1 of 3,Unknown,Welcome to [NONPROFIT],6275,6201,74,926,558,2442,58,8,8,0,0,Other
5/11/2022,12:12:38 PM,1,Unknown,jtk360 New Email Journey 1 of 3  - 2021 - ROLLING,Unknown,Welcome to [NONPROFIT],1,1,0,0,0,0,0,0,0,0,0,Other
5/11/2022,11:37:44 AM,1,Unknown,jtk360 New Email Journey 1 of 3  - 2021 - ROLLING,Unknown,Welcome to [NONPROFIT],2,2,0,0,0,0,0,0,0,0,0,Other
5/11/2022,11:07:39 AM,1,Unknown,2020-09-New-Field-Partner-Welcome-Email-1 - 2022,Unknown,Welcome to [NONPROFIT],1,1,0,0,0,1,0,0,0,0,0,Field Partners
6/11/2022,3:05:47 PM,1,Unknown,jtk360 New Email Journey 1 of 3  - 2021 - ROLLING,Unknown,Welcome to [NONPROFIT],3925,3662,263,95,46,690,29,2,2,0,0,Other
5/11/2022,12:36:43 PM,1,Unknown,jtk360 New Email Journey 1 of 3  - 2021 - ROLLING,Unknown,Welcome to [NONPROFIT],1,1,0,0,0,0,0,0,0,0,0,Other
5/9/2022,3:57:41 PM,1,Unknown,jtk360 New Email Journey 1 of 3  - 2021 - ROLLING,Unknown,Welcome to [NONPROFIT],1,1,0,0,0,0,0,0,0,0,0,Other
11/4/2021,5:06:43 PM,1,Unknown,jtk363 New Donor Journey 1 of 4 - 2021 - ROLLING,Unknown,Welcome to [NONPROFIT],11086,10971,115,372,313,4937,273,6,6,0,0,Other
6/14/2022,3:07:44 PM,1,Unknown,jtk363 New Donor Journey 1 of 4 - 2021 - ROLLING,Unknown,Welcome to [NONPROFIT],1176,1142,34,19,14,480,5,2,2,0,0,Other
4/1/2022,2:30:42 PM,1,Unknown,032022_Thank_You_CFC_Pledges_2021_NEW,Unknown,Welcome to [NONPROFIT],366,364,2,0,0,164,0,0,0,0,0,Other
1/16/2022,4:02:39 PM,1,Unknown,jtk360 New Email Journey 1 of 3  - 2021 - ROLLING,Unknown,Welcome to [NONPROFIT],4364,4296,68,353,156,1417,33,5,5,0,0,Other
10/1/2020,5:05:41 PM,1,Unknown,jtk363 New Donor Journey 1 of 4,Unknown,Welcome to [NONPROFIT],43339,42865,474,1842,1380,13507,1230,25,25,0,0,Other
2/13/2021,6:34:40 PM,1,Unknown,jtk634 - Partner Welcome Journey #6,Unknown,Your first 3 months as our Partner,892,891,1,16,11,254,0,0,0,0,0,Partners
6/14/2022,5:33:40 PM,1,Unknown,jtk634 - Partner Welcome Journey #6,Unknown,Your first 3 months as our Partner,40,40,0,0,0,16,0,0,0,0,0,Partners
6/14/2022,3:55:46 PM,1,Unknown,jtk634 - Partner Welcome Journey #6,Unknown,Your first 3 months as our Partner,2,2,0,0,0,2,0,0,0,0,0,Partners
3/23/2022,5:33:34 PM,1,Unknown,jtk634 - Partner Welcome Journey #6,Unknown,Your first 3 months as our Partner,539,539,0,11,7,247,0,0,0,0,0,Partners
11/20/2021,6:31:45 PM,1,Unknown,jtk634 - Partner Welcome Journey #6,Unknown,Your first 3 months as our Partner,210,210,0,3,3,114,0,0,0,0,0,Partners
6/17/2022,5:33:36 PM,1,Unknown,jtk634 - Partner Welcome Journey #6,Unknown,Your first 3 months as our Partner,202,202,0,2,1,99,0,0,0,0,0,Partners
6/10/2022,3:06:43 PM,1,Unknown,2021-10-Rolling-Sustainer-New-signup-Email-3,Unknown,MATCH: What does $10 make possible?,37,37,0,7,3,13,1,0,0,0,0,Other
5/17/2022,3:07:38 PM,1,Unknown,2021-10-Rolling-Sustainer-New-signup-Email-3,Unknown,MATCH: What does $10 make possible?,1,1,0,0,0,0,0,0,0,0,0,Other
5/17/2022,3:17:44 PM,1,Unknown,2021-10-Rolling-Sustainer-New-signup-Email-3,Unknown,MATCH: What does $10 make possible?,1,1,0,0,0,0,0,0,0,0,0,Other
6/14/2022,3:06:52 PM,1,Unknown,2021-10-Rolling-Sustainer-New-signup-Email-3,Unknown,MATCH: What does $10 make possible?,126,108,18,0,0,13,0,0,0,0,0,Other
6/14/2022,3:06:39 PM,1,Unknown,2021-10-Rolling-Sustainer-New-signup-Email-3,Unknown,MATCH: What does $10 make possible?,222,177,45,11,6,57,2,0,0,0,0,Other
5/9/2022,4:03:55 PM,1,Unknown,2021-10-Rolling-Sustainer-New-signup-Email-3,Unknown,MATCH: What does $10 make possible?,1,1,0,0,0,0,0,0,0,0,0,Other
5/9/2022,5:07:38 PM,1,Unknown,2021-10-Rolling-Sustainer-New-signup-Email-3,Unknown,MATCH: What does $10 make possible?,1,1,0,0,0,0,0,0,0,0,0,Other
5/6/2022,1:22:33 PM,1,Unknown,2021-10-Rolling-Sustainer-New-signup-Email-3,Unknown,MATCH: What does $10 make possible?,1,1,0,0,0,1,0,0,0,0,0,Other
3/13/2022,8:34:35 PM,1,Unknown,2021-10-Rolling-Sustainer-New-signup-Email-3,Unknown,MATCH: What does $10 make possible?,206,196,10,0,0,17,1,0,0,0,0,Other
5/9/2022,6:12:40 PM,1,Unknown,2021-10-Rolling-Sustainer-New-signup-Email-3,Unknown,MATCH: What does $10 make possible?,1,1,0,0,0,0,0,0,0,0,0,Other
5/24/2022,3:06:38 PM,1,Unknown,2021-10-Rolling-Sustainer-New-signup-Email-3,Unknown,MATCH: What does $10 make possible?,1818,1784,34,12,8,392,15,5,5,0,0,Other
11/4/2021,3:03:52 PM,1,Unknown,2021-10-Rolling-Sustainer-New-signup-Email-3,Unknown,MATCH: What does $10 make possible?,3436,3367,69,38,15,302,12,5,5,0,0,Other
5/6/2022,12:16:43 PM,1,Unknown,2021-10-Rolling-Sustainer-New-signup-Email-3,Unknown,MATCH: What does $10 make possible?,1,1,0,0,0,1,0,0,0,0,0,Other
5/11/2022,11:45:33 AM,1,Unknown,2021-10-Rolling-Sustainer-New-signup-Email-3,Unknown,MATCH: What does $10 make possible?,2,2,0,0,0,0,0,0,0,0,0,Other
11/4/2021,3:03:54 PM,1,Unknown,2021-10-Rolling-Sustainer-New-signup-Email-3,Unknown,MATCH: What does $10 make possible?,3175,3142,33,51,36,886,16,2,2,0,0,Other
5/11/2022,11:55:34 AM,1,Unknown,2021-10-Rolling-Sustainer-New-signup-Email-3,Unknown,MATCH: What does $10 make possible?,2,2,0,0,0,0,0,0,0,0,0,Other
5/11/2022,12:34:34 PM,1,Unknown,2021-10-Rolling-Sustainer-New-signup-Email-3,Unknown,MATCH: What does $10 make possible?,1,1,0,0,0,0,0,0,0,0,0,Other
3/10/2022,8:34:34 PM,1,Unknown,2021-10-Rolling-Sustainer-New-signup-Email-3,Unknown,MATCH: What does $10 make possible?,218,208,10,0,0,15,0,0,0,0,0,Other
5/11/2022,12:48:32 PM,1,Unknown,2021-10-Rolling-Sustainer-New-signup-Email-3,Unknown,MATCH: What does $10 make possible?,1,1,0,0,0,0,0,0,0,0,0,Other
5/9/2022,5:09:33 PM,1,Unknown,2021-10-Rolling-Sustainer-New-signup-Email-3,Unknown,MATCH: What does $10 make possible?,1,1,0,0,0,0,0,0,0,0,0,Other
5/11/2022,12:23:45 PM,1,Unknown,2021-10-Rolling-Sustainer-New-signup-Email-3,Unknown,MATCH: What does $10 make possible?,1,1,0,0,0,0,0,0,0,0,0,Other
8/2/2022,2:00:50 PM,1,Unknown,2022_ New Major Donor Welcome,Unknown,Welcome: Getting to Know Each Other,1,1,0,0,0,1,0,0,0,0,0,Other
12/19/2020,3:01:03 PM,1,Unknown,December 2020 Enews - FL and Non Donors,Unknown,Witnessing 2020: The year in photos,395320,394807,513,1476,1087,40633,378,61,65,0,0,Other
12/19/2020,3:00:53 PM,1,Unknown,December 2020 Enews - FP and Partners,Unknown,Witnessing 2020: The year in photos,67039,66979,60,642,487,10949,38,7,7,0,0,Partners
12/19/2020,3:01:11 PM,1,Unknown,December 2020 Enews - HIGHTOUCH,Unknown,Witnessing 2020: The year in photos,106840,106655,185,291,190,3123,49,8,8,0,0,Other
12/24/2021,3:03:02 PM,1,Unknown,2021-12-Holiday-cultivation-E1-13-37-month-donors,Unknown,Grateful for you this holiday season,169350,168815,535,1068,941,71979,561,101,103,88,15185,Lapsed Donors
6/23/2021,3:00:45 PM,1,Unknown,2021 June Insider Legacy,Unknown,Insider Update: 50 Years of Humanity,49,49,0,0,0,22,0,0,0,0,0,Other
3/19/2021,8:48:36 PM,1,Unknown,2021.03.18 March Insider,Unknown,Insider Update: 50 Years of Humanity,712,709,3,1,1,369,3,1,1,0,0,Other
6/23/2021,3:00:46 PM,1,Unknown,2021 June Insider MG to ML,Unknown,Insider Update: 50 Years of Humanity,329,327,2,1,1,122,1,0,0,0,0,Other
6/23/2021,3:00:45 PM,1,Unknown,2021 June Insider Major Gifts,Unknown,Insider Update: 50 Years of Humanity,214,214,0,0,0,101,1,1,1,0,0,Other
7/13/2022,10:15:45 PM,1,Unknown,2022-07-HIGH TOUCH-July Virtual Mapathon Invitation,Unknown,Join our Virtual Mapathon on July 21,666,659,7,29,7,134,0,0,0,0,0,Other
7/13/2022,10:15:54 PM,1,Unknown,2022-07 July Virtual Mapathon Invitation,Unknown,Join our Virtual Mapathon on July 21,85383,82222,3161,473,250,25751,50,13,13,0,0,Other
7/8/2021,10:01:05 PM,1,Unknown,2021-07 - HIGH TOUCH - July Virtual Mapathon Invitation - 20210715,Unknown,Join our virtual Mapathon on July 15,52147,52096,51,636,356,8026,147,21,23,0,0,Other
7/8/2021,10:00:44 PM,1,Unknown,2021-07 July Virtual Mapathon Invitation - Registered,Unknown,Join our virtual Mapathon on July 15,99,98,1,17,17,41,0,0,0,0,0,Other
7/8/2021,10:01:05 PM,1,Unknown,2021-07 July Virtual Mapathon Invitation - 20210715,Unknown,Join our virtual Mapathon on July 15,562276,560845,1431,1851,1051,67534,642,96,101,0,0,Other
5/27/2022,2:36:35 PM,1,Unknown,testest-v3,Unknown,Now you can do even more for doctors,1,1,0,0,0,0,0,0,0,0,0,Other
4/25/2022,1:18:36 PM,1,Unknown,testest-v3,Unknown,Now you can do even more for doctors,1,1,0,0,0,0,0,0,0,0,0,Other
5/30/2022,8:59:38 AM,1,Unknown,testest-v3,Unknown,Now you can do even more for doctors,2,2,0,15,1,2,0,0,0,0,0,Other
5/27/2022,2:49:39 PM,1,Unknown,testest-v3,Unknown,Now you can do even more for doctors,1,1,0,0,0,1,0,0,0,0,0,Other
4/25/2022,1:17:39 PM,1,Unknown,testest-v3,Unknown,Now you can do even more for doctors,1,1,0,0,0,0,0,0,0,0,0,Other
4/21/2022,4:23:35 PM,1,Unknown,testest-v3,Unknown,Now you can do even more for doctors,1,1,0,0,0,1,0,0,0,0,0,Other
6/7/2022,6:19:36 PM,1,Unknown,testest-v3,Unknown,Now you can do even more for doctors,1,1,0,1,1,1,1,0,0,0,0,Other
3/15/2022,2:00:47 PM,1,Unknown,2022 Mar Flash Briefing Invitation- Ukraine,Unknown,Flash Briefing: [NONPROFIT]?s Work in Ukraine,8635,8101,534,269,204,3693,66,5,5,0,0,Other
3/10/2022,6:29:35 PM,1,Unknown,2022 Insider Renewed AM Givers,Unknown,Insider Update on Malnutrition Crises,3,3,0,0,0,3,0,0,0,0,0,Other
3/10/2022,6:33:36 PM,1,Unknown,2022 Feb Insider New,Unknown,Insider Update on Malnutrition Crises,1,1,0,0,0,1,0,0,0,0,0,Other
3/10/2022,6:24:39 PM,1,Unknown,2022 Insider Increased AM Givers,Unknown,Insider Update on Malnutrition Crises,76,76,0,0,0,50,0,0,0,0,0,Other
3/10/2022,5:24:36 PM,1,Unknown,2022 Insider Legacy,Unknown,Insider Update on Malnutrition Crises,64,63,1,0,0,26,0,0,0,0,0,Other
3/10/2022,5:20:42 PM,1,Unknown,2022 Insider General,Unknown,Insider Update on Malnutrition Crises,106,106,0,0,0,62,0,0,0,0,0,Other
12/31/2020,4:00:44 PM,1,Unknown,jtk699 - Last Chance - partners,Unknown,Phone lines will be open late tonight,13433,13411,22,123,90,2454,9,3,3,0,0,Partners
12/31/2020,4:00:40 PM,1,Unknown,jtk699 - Last Chance - PNB,Unknown,Phone lines will be open late tonight,201,200,1,4,4,36,0,0,0,0,0,PNB
6/13/2022,12:27:34 PM,1,Unknown,jtk365 - New Donor Journey 3 of 4 - 2021 - rolling,Unknown,Save lives with just a few keystrokes,1,1,0,0,0,1,0,0,0,0,0,Other
9/15/2021,5:03:38 PM,1,Unknown,jtk365 - New Donor Journey 3 of 4 - 2021,Unknown,Save lives with just a few keystrokes,1486,1462,24,20,16,354,12,2,2,0,0,Other
6/14/2022,3:07:44 PM,1,Unknown,jtk365 - New Donor Journey 3 of 4 - 2021 - rolling,Unknown,Save lives with just a few keystrokes,1065,1043,22,22,15,381,13,1,1,0,0,Other
2/3/2022,6:04:43 PM,1,Unknown,jtk365 - New Donor Journey 3 of 4 - 2021 - rolling,Unknown,Save lives with just a few keystrokes,9666,9583,83,129,108,3888,83,5,5,0,0,Other
1/4/2022,6:03:53 PM,1,Unknown,jtk365 - New Donor Journey 3 of 4 - 2021 - rolling,Unknown,Save lives with just a few keystrokes,1641,1618,23,17,16,600,18,1,1,0,0,Other
11/4/2021,5:06:43 PM,1,Unknown,jtk365 - New Donor Journey 3 of 4 - 2021 - rolling,Unknown,Save lives with just a few keystrokes,8056,7979,77,244,215,3026,233,9,9,0,0,Other
5/21/2022,3:06:40 PM,1,Unknown,jtk365 - New Donor Journey 3 of 4 - 2021 - rolling,Unknown,Save lives with just a few keystrokes,922,901,21,13,8,347,6,1,1,0,0,Other
10/1/2020,5:07:04 PM,1,Unknown,jtk365 - New Donor Journey 3 of 4,Unknown,Save lives with just a few keystrokes,38722,38289,433,968,724,7478,750,29,29,0,0,Other
9/14/2021,7:28:34 PM,1,Unknown,2021 September Donor Roundtable Cultivation TY,Unknown,Thank You for Joining our Roundtable!,31,31,0,6,5,24,0,0,0,0,0,Other
5/26/2022,9:35:37 PM,1,Unknown,2022 May Cultivation_Xichee,Unknown,An Update from [NONPROFIT],22,22,0,4,2,16,0,0,0,0,0,Other
5/26/2022,9:34:35 PM,1,Unknown,2022 May Cultivation_Aileen,Unknown,An Update from [NONPROFIT],37,37,0,5,5,27,0,0,0,0,0,Other
5/26/2022,9:23:34 PM,1,Unknown,2022 May Cultivation_Unstewarded,Unknown,An Update from [NONPROFIT],201,201,0,16,14,123,0,0,0,0,0,Other
12/21/2020,4:50:42 PM,1,Unknown,2020 End of Year Reminder,Unknown,Greetings from [NONPROFIT],1031,1021,10,40,35,384,4,0,0,0,0,Other
2/3/2022,4:30:39 PM,1,Unknown,2022-02-03-Freewill-E1-QCD-Partner - Seed List Send,Unknown,How to maximize the impact of your RMD,11,11,0,6,4,7,0,0,0,0,0,Partners
7/19/2022,8:31:37 PM,1,Unknown,ML Insights Survey Monthly 2022 July - Initial,Unknown,Insight Panel: Your feedback in action,383,383,0,47,39,208,0,0,0,0,0,Other
4/4/2022,6:54:34 PM,1,Unknown,2022 Apr Flash Briefing Invitation- Avril in Ukraine,Unknown,Invitation: Live Briefing from Ukraine,1247,1241,6,95,51,700,3,1,1,0,0,Other
7/13/2022,5:30:40 PM,1,Unknown,2022-07-Permission to Publish-AM-RESEND,Unknown,[NONPROFIT] Annual Report listing confirmation,95,94,1,0,0,39,0,0,0,0,0,Other
7/1/2022,3:00:48 PM,1,Unknown,2022-07-Permission to Publish-Estates,Unknown,[NONPROFIT] Annual Report listing confirmation,12,12,0,0,0,4,0,0,0,0,0,Other
3/15/2021,2:00:47 PM,1,Unknown,2021-03-Permission to Publish-Corps,Unknown,[NONPROFIT] Annual Report listing confirmation,248,242,6,3,1,69,0,0,0,0,0,Other
7/1/2022,3:00:59 PM,1,Unknown,2022-07-Permission to Publish-Major Gifts,Unknown,[NONPROFIT] Annual Report listing confirmation,921,914,7,9,4,509,1,1,1,0,0,Other
7/1/2022,3:00:47 PM,1,Unknown,2022-07-Permission to Publish-Corps,Unknown,[NONPROFIT] Annual Report listing confirmation,202,194,8,18,5,60,5,0,0,0,0,Other
6/10/2022,12:00:54 PM,1,Unknown,2022-06-WRD-Fundraising-E1-13-37-Month-Donors-B,Unknown,Our World Refugee Day MATCH starts now,35379,35334,45,88,50,13120,9,3,5,18,1657,Lapsed Donors
6/10/2022,12:00:46 PM,1,Unknown,2022-06-WRD-Fundraising-E1-Partner,Unknown,Our World Refugee Day MATCH starts now,10034,10002,32,70,50,3679,3,1,1,36,41925,Partners
6/10/2022,12:00:51 PM,1,Unknown,2022-06-WRD-Fundraising-E1-Field-Partner,Unknown,Our World Refugee Day MATCH starts now,62099,61980,119,311,249,22905,20,6,6,115,11281,Field Partners
6/10/2022,8:45:43 PM,1,Unknown,2022-06-WRD-Fundraising-E1-13-37-Month-Donors-B,Unknown,Our World Refugee Day MATCH starts now,27510,27450,60,32,26,8813,12,5,5,18,1657,Lapsed Donors
6/10/2022,8:49:52 PM,1,Unknown,2022-06-WRD-Fundraising-E1-0-12-Month-Donors,Unknown,Our World Refugee Day MATCH starts now,31875,31739,136,207,133,8037,11,5,5,194,15339,First Levels
6/10/2022,8:45:53 PM,1,Unknown,2022-06-WRD-Fundraising-E1-Non-Donors,Unknown,Our World Refugee Day MATCH starts now,226977,226440,537,285,223,60948,105,29,29,17,1190.09,Non Donors
6/10/2022,12:00:57 PM,1,Unknown,2022-06-WRD-Fundraising-E1-Non-Donors,Unknown,Our World Refugee Day MATCH starts now,3765,3763,2,6,6,1689,2,1,1,17,1190.09,Non Donors
6/10/2022,12:00:54 PM,1,Unknown,2022-06-WRD-Fundraising-E1-13-37-Month-Donors-A,Unknown,Our World Refugee Day MATCH starts now,35239,35178,61,57,37,13205,16,9,10,17,12110,Lapsed Donors
6/10/2022,12:00:53 PM,1,Unknown,2022-06-WRD-Fundraising-E1-0-12-Month-Donors,Unknown,Our World Refugee Day MATCH starts now,79183,78904,279,341,283,25346,20,9,9,194,15339,First Levels
6/10/2022,8:45:42 PM,1,Unknown,2022-06-WRD-Fundraising-E1-13-37-Month-Donors-A,Unknown,Our World Refugee Day MATCH starts now,27608,27564,44,35,24,8956,5,2,2,17,12110,Lapsed Donors
6/10/2022,8:44:42 PM,1,Unknown,2022-06-WRD-Fundraising-E1-Partner,Unknown,Our World Refugee Day MATCH starts now,6828,6813,15,29,24,2726,0,0,0,36,41925,Partners
6/10/2022,4:51:00 PM,1,Unknown,2022-06-WRD-Fundraising-E1-Non-Donors,Unknown,Our World Refugee Day MATCH starts now,397,397,0,0,0,185,1,1,1,17,1190.09,Non Donors
12/31/2020,7:00:46 PM,1,Unknown,2020-12-Final-Stretch-E12-Standard-Partner,Unknown,Racing against the clock to save lives,11774,11752,22,154,123,1691,12,4,4,77,65475,Partners
10/30/2021,2:00:54 PM,1,Unknown,October 2021 Enews - FP + Partner,Unknown,Responding to Haiti's cascading crisis,73593,73457,136,716,586,17139,60,15,15,0,0,Partners
10/30/2021,2:01:01 PM,1,Unknown,October 2021 Enews - FL + Non Donors,Unknown,Responding to Haiti's cascading crisis,469664,468840,824,2058,1625,89153,599,97,97,0,0,Other
10/30/2021,2:01:11 PM,1,Unknown,October 2021 Enews - High Touch,Unknown,Responding to Haiti's cascading crisis,159082,157871,1211,167,110,3837,50,10,10,0,0,Other
9/14/2021,7:54:35 PM,1,Unknown,2021 September Donor Roundtable Cultivation Sorry We Missed You,Unknown,Sorry We Missed You at the Roundtable!,599,597,2,47,32,317,2,0,0,0,0,Other
11/12/2021,10:00:54 PM,1,Unknown,2021-11 - HIGH TOUCH - Global GIS Week Virtual Mapathon Invitation - 20211111,Unknown,Join our Global Mapathon on November 18,354,349,5,48,25,145,0,0,0,0,0,Other
1/24/2022,10:30:47 PM,1,Unknown,2022-02_HIGH TOUCH_February Virtual Mapathon Invitation,Unknown,Join our Virtual Mapathon on February 3,126,125,1,25,15,55,1,0,0,0,0,Other
10/4/2020,1:30:51 PM,1,Unknown,jtk673 - Partner Newsletter - PNB,Unknown,The Pulse: Meet the people saving lives,180,179,1,2,1,39,0,0,0,0,0,Partners
10/4/2020,1:30:52 PM,1,Unknown,jtk673 - Partner Newsletter - partners,Unknown,The Pulse: Meet the people saving lives,15156,15129,27,86,65,2978,8,3,3,0,0,Partners
4/29/2022,6:33:45 PM,1,Unknown,2022 May Flash Briefing Avril Return from Ukraine,Unknown,Virtual Event: My Assignment in Ukraine,1279,1277,2,80,66,798,0,0,0,0,0,Other
5/9/2022,5:04:35 PM,1,Unknown,jtk361 New Email Journey 2 of 3  - 2021 - ROLLING,Unknown,How much do you know about malnutrition?,1,0,1,0,0,0,0,0,0,0,0,Other
10/1/2020,3:05:34 PM,1,Unknown,jtk361 New Email Journey 2 of 3,Unknown,How much do you know about malnutrition?,5996,5924,72,557,402,1797,49,0,0,0,0,Other
1/5/2022,4:03:39 PM,1,Unknown,jtk361 New Email Journey 2 of 3  - 2021 - ROLLING,Unknown,How much do you know about malnutrition?,4104,4045,59,122,73,1142,14,3,3,0,0,Other
3/8/2022,8:34:33 PM,1,Unknown,jtk361 New Email Journey 2 of 3  - 2021 - ROLLING,Unknown,How much do you know about malnutrition?,220,209,11,0,0,22,1,0,0,0,0,Other
5/6/2022,12:13:42 PM,1,Unknown,jtk361 New Email Journey 2 of 3  - 2021 - ROLLING,Unknown,How much do you know about malnutrition?,1,1,0,0,0,1,0,0,0,0,0,Other
6/14/2022,3:05:34 PM,1,Unknown,jtk361 New Email Journey 2 of 3  - 2021 - ROLLING,Unknown,How much do you know about malnutrition?,3188,3055,133,34,23,502,15,6,6,0,0,Other
5/17/2022,3:04:36 PM,1,Unknown,jtk361 New Email Journey 2 of 3  - 2021 - ROLLING,Unknown,How much do you know about malnutrition?,1,1,0,0,0,1,0,0,0,0,0,Other
5/11/2022,12:45:31 PM,1,Unknown,jtk361 New Email Journey 2 of 3  - 2021 - ROLLING,Unknown,How much do you know about malnutrition?,1,1,0,0,0,0,0,0,0,0,0,Other
5/9/2022,4:00:45 PM,1,Unknown,jtk361 New Email Journey 2 of 3  - 2021 - ROLLING,Unknown,How much do you know about malnutrition?,1,1,0,0,0,0,0,0,0,0,0,Other
5/24/2022,3:05:51 PM,1,Unknown,jtk361 New Email Journey 2 of 3  - 2021 - ROLLING,Unknown,How much do you know about malnutrition?,212,207,5,12,7,81,0,0,0,0,0,Other
5/11/2022,11:42:31 AM,1,Unknown,jtk361 New Email Journey 2 of 3  - 2021 - ROLLING,Unknown,How much do you know about malnutrition?,2,2,0,0,0,0,0,0,0,0,0,Other
11/4/2021,3:04:32 PM,1,Unknown,jtk361 New Email Journey 2 of 3  - 2021 - ROLLING,Unknown,How much do you know about malnutrition?,734,728,6,42,29,246,2,0,0,0,0,Other
5/11/2022,12:20:43 PM,1,Unknown,jtk361 New Email Journey 2 of 3  - 2021 - ROLLING,Unknown,How much do you know about malnutrition?,1,1,0,0,0,0,0,0,0,0,0,Other
6/10/2022,3:07:34 PM,1,Unknown,jtk361 New Email Journey 2 of 3  - 2021 - ROLLING,Unknown,How much do you know about malnutrition?,47,46,1,4,2,17,0,0,0,0,0,Other
9/15/2021,3:03:37 PM,1,Unknown,jtk361 New Email Journey 2 of 3  - 2021,Unknown,How much do you know about malnutrition?,631,619,12,58,43,182,4,1,1,0,0,Other
6/13/2022,3:03:36 PM,1,Unknown,jtk633 - Partner Welcome Journey #4,Unknown,50 years of humanitarian aid and counting,1,1,0,0,0,1,0,0,0,0,0,Partners
5/27/2022,4:36:40 AM,1,Unknown,jtk633 - Partner Welcome Journey #4,Unknown,50 years of humanitarian aid and counting,1,1,0,0,0,1,0,0,0,0,0,Partners
2/13/2021,6:34:43 PM,1,Unknown,jtk633 - Partner Welcome Journey #4,Unknown,50 years of humanitarian aid and counting,449,440,9,26,18,122,3,1,1,0,0,Partners
6/18/2022,5:33:32 PM,1,Unknown,jtk633 - Partner Welcome Journey #4,Unknown,50 years of humanitarian aid and counting,18,17,1,0,0,8,0,0,0,0,0,Partners
2/12/2021,3:00:38 PM,1,Unknown,jtk633 - Partner Welcome Journey #4,Unknown,50 years of humanitarian aid and counting,61,61,0,3,1,12,0,0,0,0,0,Partners
6/15/2022,5:33:43 PM,1,Unknown,jtk633 - Partner Welcome Journey #4,Unknown,50 years of humanitarian aid and counting,9,9,0,0,0,6,0,0,0,0,0,Partners
1/5/2022,6:32:35 PM,1,Unknown,jtk633 - Partner Welcome Journey #4,Unknown,50 years of humanitarian aid and counting,425,423,2,18,14,212,0,0,0,0,0,Partners
12/8/2021,6:32:31 PM,1,Unknown,jtk633 - Partner Welcome Journey #4,Unknown,50 years of humanitarian aid and counting,271,266,5,9,9,137,1,0,0,0,0,Partners
11/1/2021,9:14:07 PM,1,Unknown,2021 Annual Report,Unknown,Annual Report for [NONPROFIT],357,356,1,72,50,191,2,1,1,0,0,Other
2/1/2022,6:55:37 PM,1,Unknown,2022 Feb Flash Briefing- Afghanistan,Unknown,Flash Briefing: [NONPROFIT]?s Work in Afghanistan,1013,1009,4,59,48,650,1,1,1,0,0,Other
1/27/2021,3:00:54 PM,1,Unknown,2021-01-Other-Vaccines-E3-Standard-Partner,Unknown,How you can support [NONPROFIT] vaccine campaigns,14874,14852,22,77,67,2907,14,7,7,19,14200,Partners
7/30/2021,3:38:42 PM,1,Unknown,2021 July Interests Survey,Unknown,Invitation: [NONPROFIT] Survey of Donor Interests,171,171,0,52,40,99,4,3,3,0,0,Other
7/30/2021,4:36:51 PM,1,Unknown,2021 July Interests Survey Part 2,Unknown,Invitation: [NONPROFIT] Survey of Donor Interests,748,740,8,139,111,337,4,4,4,0,0,Other
9/15/2021,9:30:51 PM,1,Unknown,2021-09 September Virtual Mapathon Invitation,Unknown,Join our Virtual Mapathon on September 23,61779,61724,55,261,199,11020,33,13,13,0,0,Other
9/15/2021,9:30:57 PM,1,Unknown,2021-09 - HIGH TOUCH - September Virtual Mapathon Invitation,Unknown,Join our Virtual Mapathon on September 23,751,744,7,6,3,127,2,0,0,0,0,Other
4/7/2021,1:54:34 PM,1,Unknown,2021.04.07 Syria Cultivation,Unknown,An [NONPROFIT] update on the ongoing Syrian crisis,80,80,0,1,1,42,1,0,0,0,0,Other
5/13/2021,10:01:03 PM,1,Unknown,2021-05 A Decade of War in Syria Webinar - 20210520,Unknown,Join our webcast: A decade of war in Syria,534742,533446,1296,1092,693,52371,275,45,46,0,0,Other
5/13/2021,10:01:03 PM,1,Unknown,2021-05-HIGH TOUCH-A Decade of War in Syria Webinar - 20210520,Unknown,Join our webcast: A decade of war in Syria,68670,68262,408,1993,1023,11840,302,64,64,0,0,Other
1/29/2022,3:01:02 PM,1,Unknown,January 2022 Enews - FP and Partner,Unknown,Responding to a surge of fighting in Yemen,76197,76054,143,674,440,28521,45,18,18,0,0,Partners
1/29/2022,3:01:15 PM,1,Unknown,January 2022 Enews- High Touch - 20220128_131522,Unknown,Responding to a surge of fighting in Yemen,170050,168917,1133,229,153,5253,79,17,17,0,0,Other
1/29/2022,3:01:02 PM,1,Unknown,January 2022 Enews- FL and ND,Unknown,Responding to a surge of fighting in Yemen,438317,437116,1201,1381,1004,131269,532,82,84,0,0,Other
3/26/2021,2:00:54 PM,1,Unknown,2021-03-Partner-Newsletter-Partner-B,Unknown,The Pulse: Weathering the challenges ahead,8153,8142,11,37,32,1574,12,4,4,0,0,Partners
6/16/2022,3:07:51 PM,1,Unknown,jtk364 2019-12 New Donor Journey 2 of 4 - 2021 - ROLLING,Unknown,Why do YOU support [NONPROFIT]?,1033,1013,20,50,39,389,7,0,0,0,0,Other
11/4/2021,5:06:33 PM,1,Unknown,jtk364 2019-12 New Donor Journey 2 of 4 - 2021 - ROLLING,Unknown,Why do YOU support [NONPROFIT]?,9343,9268,75,685,483,3617,61,6,6,0,0,Other
6/14/2022,5:27:44 PM,1,Unknown,2020-09-New-Field-Partner-Welcome-Email-2 - 2022,Unknown,Why do YOU support [NONPROFIT]?,3,3,0,1,1,2,0,0,0,0,0,Field Partners
5/15/2022,9:11:41 AM,1,Unknown,jtk364 2019-12 New Donor Journey 2 of 4 - 2021 - ROLLING,Unknown,Why do YOU support [NONPROFIT]?,1,1,0,0,0,0,0,0,0,0,0,Other
5/14/2022,11:07:37 AM,1,Unknown,2020-09-New-Field-Partner-Welcome-Email-2 - 2022,Unknown,Why do YOU support [NONPROFIT]?,1,1,0,0,0,1,0,0,0,0,0,Field Partners
3/12/2022,7:05:35 PM,1,Unknown,2020-09-New-Field-Partner-Welcome-Email-2 - 2022,Unknown,Why do YOU support [NONPROFIT]?,138,138,0,16,14,64,0,0,0,0,0,Field Partners
4/24/2022,4:06:37 PM,1,Unknown,2020-09-New-Field-Partner-Welcome-Email-2 - 2022,Unknown,Why do YOU support [NONPROFIT]?,80,80,0,9,7,39,0,0,0,0,0,Field Partners
10/1/2020,5:05:41 PM,1,Unknown,jtk364 2019-12 New Donor Journey 2 of 4,Unknown,Why do YOU support [NONPROFIT]?,40256,39822,434,2516,2123,9323,743,30,31,0,0,Other
2/4/2022,6:04:38 PM,1,Unknown,jtk364 2019-12 New Donor Journey 2 of 4 - 2021 - ROLLING,Unknown,Why do YOU support [NONPROFIT]?,9901,9823,78,568,496,4106,75,4,4,0,0,Other
5/21/2022,3:06:46 PM,1,Unknown,jtk364 2019-12 New Donor Journey 2 of 4 - 2021 - ROLLING,Unknown,Why do YOU support [NONPROFIT]?,908,886,22,40,34,355,8,0,0,0,0,Other
6/14/2022,4:05:48 PM,1,Unknown,2020-09-New-Field-Partner-Welcome-Email-2 - 2022,Unknown,Why do YOU support [NONPROFIT]?,1283,1257,26,64,58,475,1,1,1,0,0,Field Partners
9/15/2021,5:03:53 PM,1,Unknown,jtk364 2019-12 New Donor Journey 2 of 4 - 2021,Unknown,Why do YOU support [NONPROFIT]?,1485,1464,21,88,77,411,5,1,1,0,0,Other
1/4/2022,6:03:32 PM,1,Unknown,jtk364 2019-12 New Donor Journey 2 of 4 - 2021 - ROLLING,Unknown,Why do YOU support [NONPROFIT]?,1057,1036,21,62,49,379,8,0,0,0,0,Other
5/24/2022,4:06:40 PM,1,Unknown,2020-09-New-Field-Partner-Welcome-Email-2 - 2022,Unknown,Why do YOU support [NONPROFIT]?,73,73,0,5,4,25,0,0,0,0,0,Field Partners
6/11/2022,12:27:33 PM,1,Unknown,jtk364 2019-12 New Donor Journey 2 of 4 - 2021 - ROLLING,Unknown,Why do YOU support [NONPROFIT]?,1,1,0,0,0,1,0,0,0,0,0,Other
12/9/2020,11:10:42 PM,1,Unknown,jtk694 - December Ways to Give - Partners,Unknown,As you finalize your charitable giving plans,14778,14749,29,104,69,2959,6,2,2,0,0,Partners
12/9/2020,11:05:39 PM,1,Unknown,jtk694 - December Ways to Give - PNB,Unknown,As you finalize your charitable giving plans,184,182,2,1,1,38,0,0,0,0,0,PNB
8/17/2021,11:35:24 PM,1,Unknown,2021-08-Haiti-Earthquake-E2-PNB-FM,Unknown,Fwd: UPDATE: Tropical Storm Grace hits Haiti,212,212,0,1,1,62,0,0,0,0,0,PNB
10/28/2021,2:00:48 PM,1,Unknown,2021 Fall Insider_MGCULT,Unknown,Insider Update: [NONPROFIT]'s History in Afghanistan,1,1,0,0,0,1,0,0,0,0,0,Other
10/28/2021,2:00:51 PM,1,Unknown,2021 Fall Insider_Midevel,Unknown,Insider Update: [NONPROFIT]'s History in Afghanistan,346,343,3,3,2,172,2,0,0,0,0,Other
11/11/2021,10:02:38 PM,1,Unknown,2021 Fall Insider_Wolpert,Unknown,Insider Update: [NONPROFIT]'s History in Afghanistan,2,2,0,0,0,1,0,0,0,0,0,Other
10/28/2021,2:00:49 PM,1,Unknown,2021 Fall Insider_Major,Unknown,Insider Update: [NONPROFIT]'s History in Afghanistan,166,166,0,0,0,88,0,0,0,0,0,Other
10/28/2021,2:00:49 PM,1,Unknown,2021 Fall Insider_Legacy,Unknown,Insider Update: [NONPROFIT]'s History in Afghanistan,59,58,1,0,0,24,0,0,0,0,0,Other
11/1/2021,8:39:34 PM,1,Unknown,2021 Fall Insider_Major,Unknown,Insider Update: [NONPROFIT]'s History in Afghanistan,2,2,0,0,0,1,0,0,0,0,0,Other
2/17/2021,9:59:36 PM,1,Unknown,20201 Increased Giving Letter,Unknown,Thank you for your generous support in 2020!,252,252,0,0,0,123,0,0,0,0,0,Other
4/29/2022,6:43:40 PM,1,Unknown,2022 May Flash Briefing Avril Return from Ukraine MIDLEVEL,Unknown,Virtual Event: Avril's Assignment in Ukraine,63,62,1,1,1,35,2,0,0,0,0,Other
2/27/2022,3:01:00 PM,1,Unknown,February 2022 Enews - FL and Non Donor,Unknown,Navigating conflict and crisis in Afghanistan,432352,431455,897,1389,979,136401,414,59,60,0,0,Other
2/27/2022,3:00:59 PM,1,Unknown,February 2022 Enews - FP and Partner,Unknown,Navigating conflict and crisis in Afghanistan,75813,75701,112,711,475,29161,37,12,12,0,0,Partners
2/27/2022,3:01:08 PM,1,Unknown,February 2022 Enews - High Touch,Unknown,Navigating conflict and crisis in Afghanistan,170576,169341,1235,182,129,4704,81,15,15,0,0,Other
5/21/2022,3:06:40 PM,1,Unknown,jtk366 2019-12 New Donor Journey 4 of 4 - 2021 - ROLLING,Unknown,RE: Save the world with just a few keystrokes,792,774,18,5,5,291,4,2,2,0,0,Other
11/4/2021,5:04:34 PM,1,Unknown,jtk366 2019-12 New Donor Journey 4 of 4 - 2021 - ROLLING,Unknown,RE: Save the world with just a few keystrokes,5838,5780,58,112,57,1914,27,6,6,0,0,Other
10/1/2020,5:09:44 PM,1,Unknown,jtk366 2019-12 New Donor Journey 4 of 4,Unknown,RE: Save the world with just a few keystrokes,37520,37120,400,662,491,7411,529,37,37,0,0,Other
3/31/2022,5:06:43 PM,1,Unknown,jtk366 2019-12 New Donor Journey 4 of 4 - 2021 - ROLLING,Unknown,RE: Save the world with just a few keystrokes,4487,4451,36,64,42,1804,38,6,6,0,0,Other
6/15/2022,12:27:37 PM,1,Unknown,jtk366 2019-12 New Donor Journey 4 of 4 - 2021 - ROLLING,Unknown,RE: Save the world with just a few keystrokes,1,1,0,0,0,1,0,0,0,0,0,Other
1/4/2022,6:04:42 PM,1,Unknown,jtk366 2019-12 New Donor Journey 4 of 4 - 2021 - ROLLING,Unknown,RE: Save the world with just a few keystrokes,1740,1728,12,21,18,604,18,3,3,0,0,Other
6/14/2022,3:07:48 PM,1,Unknown,jtk366 2019-12 New Donor Journey 4 of 4 - 2021 - ROLLING,Unknown,RE: Save the world with just a few keystrokes,1109,1090,19,12,9,377,5,0,0,0,0,Other
2/3/2022,6:04:43 PM,1,Unknown,jtk366 2019-12 New Donor Journey 4 of 4 - 2021 - ROLLING,Unknown,RE: Save the world with just a few keystrokes,5042,4999,43,59,53,2074,32,4,5,0,0,Other
1/21/2022,6:04:05 PM,1,Unknown,jtk366 2019-12 New Donor Journey 4 of 4 - 2021 - ROLLING,Unknown,RE: Save the world with just a few keystrokes,475,459,16,5,5,169,5,0,0,0,0,Other
9/15/2021,5:03:57 PM,1,Unknown,jtk366 2019-12 New Donor Journey 4 of 4 - 2021,Unknown,RE: Save the world with just a few keystrokes,1460,1445,15,28,21,358,17,1,1,0,0,Other
11/12/2020,11:00:53 PM,1,Unknown,2020.11.17 Webinar Invitation - Field Partners,Unknown,RSVP: Exclusive Webinar With Dr. Rasha Khoury,59297,59241,56,288,222,9689,14,5,5,0,0,Partners
11/12/2020,11:00:53 PM,1,Unknown,2020.11.17 Webinar Invitation - Partners,Unknown,RSVP: Exclusive Webinar With Dr. Rasha Khoury,12251,12238,13,63,40,2343,5,3,3,0,0,Partners
3/15/2021,2:00:47 PM,1,Unknown,2021-03-Permission to Publish-Legacy,Unknown,Confirming your listing in [NONPROFIT]?s Annual report,337,334,3,1,1,87,1,0,0,0,0,Other
3/15/2021,2:00:45 PM,1,Unknown,2021-03-Permission to Publish-Estates,Unknown,Confirming your listing in [NONPROFIT]?s Annual report,21,19,2,0,0,7,0,0,0,0,0,Other
7/1/2022,3:00:53 PM,1,Unknown,2022-07-Permission to Publish-Legacy,Unknown,Confirming your listing in [NONPROFIT]?s Annual report,641,637,4,15,9,261,8,0,0,0,0,Other
3/16/2022,6:48:36 PM,1,Unknown,2022 Mar Flash Briefing Invitation- Ukraine - 20220316_144134,Unknown,Flash Briefing Tomorrow: [NONPROFIT]?s Work in Ukraine,204,199,5,16,12,119,0,0,0,0,0,Other
7/23/2021,5:00:42 PM,1,Unknown,2021-07-DM-Partners-Outbreak-E1-PNB,fundraising,Help us prepare for outbreaks around the world,122,122,0,1,1,29,0,0,0,0,0,Partners
7/23/2021,5:00:40 PM,1,Unknown,2021-07-DM-Partners-Outbreak-E1-Partner,fundraising,Help us prepare for outbreaks around the world,9603,9591,12,26,20,2001,8,2,2,2,750,Partners
8/23/2022,6:05:39 PM,1,Unknown,ML Insights Survey Monthly 2022 August - Initial,Unknown,Insight Panel: Our team answers your questions,468,468,0,42,37,248,0,0,0,0,0,Other
9/22/2021,10:30:36 PM,1,Unknown,2021-09-Sept-Match-E3-0-12-month-donors-seed,Unknown,Support [NONPROFIT] teams on the ground in Afghanistan,20,20,0,5,2,14,0,0,0,0,0,First Levels
11/24/2020,10:30:38 PM,1,Unknown,2020-11-Corps-Annual-Report,Unknown,2019 Annual Report from [NONPROFIT],1018,943,75,95,36,258,10,1,1,0,0,Other
11/9/2021,10:00:43 PM,1,Unknown,2021-11-Corporations-Annual-Report,Unknown,2020 Annual Report from [NONPROFIT],703,665,38,32,18,178,6,0,0,0,0,Other
9/25/2021,2:01:03 PM,1,Unknown,September 2021 Enews - FL+ Non Donor,Unknown,Caring for migrants trapped in danger in Mexico,462768,462119,649,1943,1528,75049,705,116,116,0,0,Other
9/25/2021,2:01:16 PM,1,Unknown,September 2021 Enews - High Touch,Unknown,Caring for migrants trapped in danger in Mexico,153029,151881,1148,117,101,2792,85,29,29,0,0,Other
